Date,Year,Month,Day,Mean Temp (°C),Min Temp (°C),Max Temp (°C),Total Precip (mm),Spd of Max Gust (km/h)
01/01/2020,2020,1,1,25.1,21.8,28.5,20.1,0
01/02/2020,2020,1,2,24.2,21.4,27.2,1,0
01/03/2020,2020,1,3,24.1,22.3,26.4,1,0
01/04/2020,2020,1,4,24.7,22.5,28.3,3,0
01/05/2020,2020,1,5,23.4,21.2,27.9,18,0
01/06/2020,2020,1,6,24.9,20.9,28.9,87.9,0
01/07/2020,2020,1,7,25.7,22.8,29,34,0
01/08/2020,2020,1,8,25,21.85,28.9,4.1,0
01/09/2020,2020,1,9,24.5,21.8,28.8,2,0
01/10/2020,2020,1,10,23.6,19.2,27.8,0,0
01/11/2020,2020,1,11,24.1,19.3,28.7,0,0
01/12/2020,2020,1,12,24.7,22.3,29.6,2,0
13/01/2020,2020,1,13,25.2,21.9,29.4,2,0
14/01/2020,2020,1,14,26.3,23.4,30.3,0,0
15/01/2020,2020,1,15,24.8,23.5,28.5,1,0
16/01/2020,2020,1,16,24.4,23.3,27.1,20.1,0
17/01/2020,2020,1,17,24.9,22.6,28.5,7.9,0
18/01/2020,2020,1,18,25.6,22.6,29.3,0,0
19/01/2020,2020,1,19,25.7,23.4,29.1,0,0
20/01/2020,2020,1,20,26.1,23.8,29.8,1,0
21/01/2020,2020,1,21,23.9,23.6,26.4,0,0
22/01/2020,2020,1,22,23.4,22.7,24.5,55.1,0
23/01/2020,2020,1,23,25.4,23,29.4,22.1,0
24/01/2020,2020,1,24,24,22.5,25.9,17,0
25/01/2020,2020,1,25,24.2,22.75,26.8,30,0
26/01/2020,2020,1,26,23.5,21.2,26.5,0.8,0
27/01/2020,2020,1,27,22.6,20.7,26,4.1,0
28/01/2020,2020,1,28,21.9,18.2,25.1,0,0
29/01/2020,2020,1,29,22.2,18.1,26.4,0.5,0
30/01/2020,2020,1,30,23.8,20.2,28.4,0.5,0
31/01/2020,2020,1,31,23.2,20.4,27.2,10.9,0
02/01/2020,2020,2,1,24.4,22,27.6,3,0
02/02/2020,2020,2,2,24.6,22.1,28.2,0,0
02/03/2020,2020,2,3,24.5,22.3,27.8,20.1,0
02/04/2020,2020,2,4,23.7,22.3,26.4,3,0
02/05/2020,2020,2,5,24.1,22.3,28.2,40.9,0
02/06/2020,2020,2,6,24.2,22.5,27.9,17,0
02/07/2020,2020,2,7,23.9,21.4,28.3,0,0
02/08/2020,2020,2,8,24.1,21.5,28.4,0.5,0
02/09/2020,2020,2,9,23.9,20.5,27.8,2,0
02/10/2020,2020,2,10,23.1,21.3,26.4,3,0
02/11/2020,2020,2,11,24.2,22.4,26.6,30,0
02/12/2020,2020,2,12,24.7,21.85,28.5,35.1,0
13/02/2020,2020,2,13,25.2,22.6,29.1,0,0
14/02/2020,2020,2,14,25.7,22,30.5,0,0
15/02/2020,2020,2,15,24.6,23.1,28.3,17,0
16/02/2020,2020,2,16,24.2,21.6,28.4,1,0
17/02/2020,2020,2,17,23.7,20.4,28.2,0,0
18/02/2020,2020,2,18,24.2,21.5,28.1,4.1,0
19/02/2020,2020,2,19,23.9,21.6,27.6,1,0
20/02/2020,2020,2,20,23.7,20.4,27.8,5.1,0
21/02/2020,2020,2,21,23.9,21.1,27.9,1,0
22/02/2020,2020,2,22,24.1,20.5,28.3,1,0
23/02/2020,2020,2,23,24.3,21.9,28.1,1,0
24/02/2020,2020,2,24,24.8,19.5,29.4,0,0
25/02/2020,2020,2,25,25.6,21.8,29.2,0,0
26/02/2020,2020,2,26,23.7,21.9,27.3,42.9,0
27/02/2020,2020,2,27,23.7,21.85,25.8,7.1,0
28/02/2020,2020,2,28,23.8,21.9,27.2,8.9,0
29/02/2020,2020,2,29,24.9,21.8,29.6,14,0
03/01/2020,2020,3,1,25.4,22.7,28.9,2,0
03/02/2020,2020,3,2,24.7,23,27.3,2,0
03/03/2020,2020,3,3,25.3,23.8,29.8,8.9,0
03/04/2020,2020,3,4,25.1,22.1,28.9,2,0
03/05/2020,2020,3,5,25.200000000000003,22.950000000000003,29.35,5.45,0
03/06/2020,2020,3,6,25.2,22.1,28.4,3,0
03/07/2020,2020,3,7,24.2,19.4,28,6.1,0
03/08/2020,2020,3,8,23.6,19.4,28,73.9,0
03/09/2020,2020,3,9,23.4,21.7,26.1,7.9,0
03/10/2020,2020,3,10,23.5,21.7,27.05,40.900000000000006,0
03/11/2020,2020,3,11,25.4,21.7,30.1,15,0
03/12/2020,2020,3,12,25.4,19.4,30.1,15,0
13/03/2020,2020,3,13,22.6,19.4,24.9,57.9,0
14/03/2020,2020,3,14,23.7,19.4,27.6,57.9,0
15/03/2020,2020,3,15,23.15,19.4,26.25,57.9,0
16/03/2020,2020,3,16,23.7,19.4,27.6,1.3,0
17/03/2020,2020,3,17,22,19.4,25.3,1.3,0
18/03/2020,2020,3,18,24.1,19.4,28.8,0.3,0
19/03/2020,2020,3,19,24.1,19.4,28.8,0.3,0
20/03/2020,2020,3,20,24.1,19.4,28.8,0.3,0
21/03/2020,2020,3,21,22.4,17.1,27.3,0,0
22/03/2020,2020,3,22,22.9,20.5,26.6,0.5,0
23/03/2020,2020,3,23,24.2,22.5,27.2,7.1,0
24/03/2020,2020,3,24,23.2,21.5,25.6,61,0
25/03/2020,2020,3,25,24.7,22.4,28.1,1,0
26/03/2020,2020,3,26,23.95,22.4,26.850000000000005,31,0
27/03/2020,2020,3,27,24.7,22.4,28.1,1,0
28/03/2020,2020,3,28,22,19.4,25.3,1.3,0
29/03/2020,2020,3,29,22,19.4,25.3,1.3,0
30/03/2020,2020,3,30,22,19.4,25.3,1.3,0
31/03/2020,2020,3,31,22,19.4,25.3,1.3,0
04/01/2020,2020,4,1,22,19.4,25.3,1.3,0
04/02/2020,2020,4,2,22,19.4,25.3,1.3,0
04/03/2020,2020,4,3,22,19.4,25.3,1.3,0
04/04/2020,2020,4,4,22,19.4,25.3,1.3,0
04/05/2020,2020,4,5,22,19.4,25.3,1.3,0
04/06/2020,2020,4,6,22,19.4,25.3,1.3,0
04/07/2020,2020,4,7,22,19.4,25.3,1.3,0
04/08/2020,2020,4,8,22,19.4,25.3,1.3,0
04/09/2020,2020,4,9,22,19.4,25.3,1.3,0
04/10/2020,2020,4,10,22,19.4,25.3,1.3,0
04/11/2020,2020,4,11,22,19.4,25.3,1.3,0
04/12/2020,2020,4,12,22,19.4,25.3,1.3,0
13/04/2020,2020,4,13,22,19.4,25.3,1.3,0
14/04/2020,2020,4,14,22,19.4,25.3,1.3,0
15/04/2020,2020,4,15,22,19.4,25.3,1.3,0
16/04/2020,2020,4,16,22,19.4,25.3,1.3,0
17/04/2020,2020,4,17,22,19.4,25.3,1.3,0
18/04/2020,2020,4,18,22,19.4,25.3,1.3,0
19/04/2020,2020,4,19,22,19.4,25.3,1.3,0
20/04/2020,2020,4,20,22,19.4,25.3,1.3,0
21/04/2020,2020,4,21,22,19.4,25.3,1.3,0
22/04/2020,2020,4,22,22,19.4,25.3,1.3,0
23/04/2020,2020,4,23,23.3,19.4,27.5,0,0
24/04/2020,2020,4,24,22.3,19.4,25.1,0.8,0
25/04/2020,2020,4,25,23.1,21.1,26.8,1,0
26/04/2020,2020,4,26,22.700000000000003,21.1,25.950000000000003,0.9,0
27/04/2020,2020,4,27,23.1,21.1,26.8,1,0
28/04/2020,2020,4,28,22,19.4,25.3,1.3,0
29/04/2020,2020,4,29,22,19.4,25.3,1.3,0
30/04/2020,2020,4,30,22,19.4,25.3,1.3,0
05/01/2020,2020,5,1,22,19.4,25.3,1.3,0
05/02/2020,2020,5,2,22,19.4,25.3,1.3,0
05/03/2020,2020,5,3,22,19.4,25.3,1.3,0
05/04/2020,2020,5,4,22,19.4,25.3,1.3,0
05/05/2020,2020,5,5,22,19.4,25.3,1.3,0
05/06/2020,2020,5,6,22,19.4,25.3,1.3,0
05/07/2020,2020,5,7,22,19.4,25.3,1.3,0
05/08/2020,2020,5,8,22,19.4,25.3,1.3,0
05/09/2020,2020,5,9,22,19.4,25.3,1.3,0
05/10/2020,2020,5,10,22,19.4,25.3,1.3,0
05/11/2020,2020,5,11,22,19.4,25.3,1.3,0
05/12/2020,2020,5,12,22,19.4,25.3,1.3,0
13/05/2020,2020,5,13,22,19.4,25.3,1.3,0
14/05/2020,2020,5,14,22,19.4,25.3,1.3,0
15/05/2020,2020,5,15,22,19.4,25.3,1.3,0
16/05/2020,2020,5,16,21.8,19.4,27.4,0,0
17/05/2020,2020,5,17,21.8,19.4,27.4,0,0
18/05/2020,2020,5,18,21.8,19.4,27.4,0,0
19/05/2020,2020,5,19,22,19.4,25.3,1.3,0
20/05/2020,2020,5,20,22,19.4,25.3,1.3,0
21/05/2020,2020,5,21,22,19.4,25.3,1.3,0
22/05/2020,2020,5,22,22,19.4,25.3,1.3,0
23/05/2020,2020,5,23,22,19.4,25.3,1.3,0
24/05/2020,2020,5,24,22,19.4,25.3,1.3,0
25/05/2020,2020,5,25,19.7,19.4,23.6,1,0
26/05/2020,2020,5,26,19.7,19.4,23.6,1,0
27/05/2020,2020,5,27,19.7,19.4,23.6,1,0
28/05/2020,2020,5,28,22,19.4,25.3,1.3,0
29/05/2020,2020,5,29,22,19.4,25.3,1.3,0
30/05/2020,2020,5,30,22,19.4,25.3,1.3,0
31/05/2020,2020,5,31,22,19.4,25.3,1.3,0
06/01/2020,2020,6,1,22,19.4,25.3,1.3,0
06/02/2020,2020,6,2,22,19.4,25.3,1.3,0
06/03/2020,2020,6,3,22,19.4,25.3,1.3,0
06/04/2020,2020,6,4,22,19.4,25.3,1.3,0
06/05/2020,2020,6,5,22,19.4,25.3,1.3,0
06/06/2020,2020,6,6,22,19.4,25.3,1.3,0
06/07/2020,2020,6,7,22,19.4,25.3,1.3,0
06/08/2020,2020,6,8,22,19.4,25.3,1.3,0
06/09/2020,2020,6,9,22,19.4,25.3,1.3,0
06/10/2020,2020,6,10,22,19.4,25.3,1.3,0
06/11/2020,2020,6,11,22,19.4,25.3,1.3,0
06/12/2020,2020,6,12,22,19.4,25.3,1.3,0
13/06/2020,2020,6,13,22,19.4,25.3,1.3,0
14/06/2020,2020,6,14,22,19.4,25.3,1.3,0
15/06/2020,2020,6,15,22,19.4,25.3,1.3,0
16/06/2020,2020,6,16,22,19.4,25.3,1.3,0
17/06/2020,2020,6,17,22,19.4,25.3,1.3,0
18/06/2020,2020,6,18,22,19.4,25.3,1.3,0
19/06/2020,2020,6,19,22,19.4,25.3,1.3,0
20/06/2020,2020,6,20,22,19.4,25.3,1.3,0
21/06/2020,2020,6,21,22,19.4,25.3,1.3,0
22/06/2020,2020,6,22,22,19.4,25.3,1.3,0
23/06/2020,2020,6,23,22,19.4,25.3,1.3,0
24/06/2020,2020,6,24,22,19.4,25.3,1.3,0
25/06/2020,2020,6,25,22,19.4,25.3,1.3,0
26/06/2020,2020,6,26,22,19.4,25.3,1.3,0
27/06/2020,2020,6,27,22,19.4,25.3,1.3,0
28/06/2020,2020,6,28,22,19.4,25.3,1.3,0
29/06/2020,2020,6,29,22,19.4,25.3,1.3,0
30/06/2020,2020,6,30,22,19.4,25.3,1.3,0
07/01/2020,2020,7,1,22,19.4,25.3,1.3,0
07/02/2020,2020,7,2,22,19.4,25.3,1.3,0
07/03/2020,2020,7,3,22,19.4,25.3,1.3,0
07/04/2020,2020,7,4,22,19.4,25.3,1.3,0
07/05/2020,2020,7,5,22,19.4,25.3,1.3,0
07/06/2020,2020,7,6,22,19.4,25.3,1.3,0
07/07/2020,2020,7,7,22,19.4,25.3,1.3,0
07/08/2020,2020,7,8,22,19.4,25.3,1.3,0
07/09/2020,2020,7,9,22,19.4,25.3,1.3,0
07/10/2020,2020,7,10,22,19.4,25.3,1.3,0
07/11/2020,2020,7,11,22,19.4,25.3,1.3,0
07/12/2020,2020,7,12,22,19.4,25.3,1.3,0
13/07/2020,2020,7,13,22,19.4,25.3,1.3,0
14/07/2020,2020,7,14,22,19.4,25.3,1.3,0
15/07/2020,2020,7,15,22,19.4,25.3,1.3,0
16/07/2020,2020,7,16,22,19.4,25.3,1.3,0
17/07/2020,2020,7,17,22,19.4,25.3,1.3,0
18/07/2020,2020,7,18,22,19.4,25.3,1.3,0
19/07/2020,2020,7,19,22,19.4,25.3,1.3,0
20/07/2020,2020,7,20,22,19.4,25.3,1.3,0
21/07/2020,2020,7,21,22,19.4,25.3,1.3,0
22/07/2020,2020,7,22,22,19.4,25.3,1.3,0
23/07/2020,2020,7,23,22,19.4,25.3,1.3,0
24/07/2020,2020,7,24,22,19.4,25.3,1.3,0
25/07/2020,2020,7,25,22,19.4,25.3,1.3,0
26/07/2020,2020,7,26,22,19.4,25.3,1.3,0
27/07/2020,2020,7,27,22,19.4,25.3,1.3,0
28/07/2020,2020,7,28,22,19.4,25.3,1.3,0
29/07/2020,2020,7,29,22,19.4,25.3,1.3,0
30/07/2020,2020,7,30,22,19.4,25.3,1.3,0
31/07/2020,2020,7,31,22,19.4,25.3,1.3,0
08/01/2020,2020,8,1,22,19.4,25.3,1.3,0
08/02/2020,2020,8,2,22,19.4,25.3,1.3,0
08/03/2020,2020,8,3,22,19.4,25.3,1.3,0
08/04/2020,2020,8,4,22,19.4,25.3,1.3,0
08/05/2020,2020,8,5,22,19.4,25.3,1.3,0
08/06/2020,2020,8,6,22,19.4,25.3,1.3,0
08/07/2020,2020,8,7,22,19.4,25.3,1.3,0
08/08/2020,2020,8,8,22,19.4,25.3,1.3,0
08/09/2020,2020,8,9,22,19.4,25.3,1.3,0
08/10/2020,2020,8,10,22,19.4,25.3,1.3,0
08/11/2020,2020,8,11,22,19.4,25.3,1.3,0
08/12/2020,2020,8,12,22,19.4,25.3,1.3,0
13/08/2020,2020,8,13,22,19.4,25.3,1.3,0
14/08/2020,2020,8,14,22,19.4,25.3,1.3,0
15/08/2020,2020,8,15,22,19.4,25.3,1.3,0
16/08/2020,2020,8,16,22,19.4,25.3,1.3,0
17/08/2020,2020,8,17,22,19.4,25.3,1.3,0
18/08/2020,2020,8,18,22,19.4,25.3,1.3,0
19/08/2020,2020,8,19,22,19.4,25.3,1.3,0
20/08/2020,2020,8,20,22,19.4,25.3,1.3,0
21/08/2020,2020,8,21,22,19.4,25.3,1.3,0
22/08/2020,2020,8,22,22,19.4,25.3,1.3,0
23/08/2020,2020,8,23,22,19.4,25.3,1.3,0
24/08/2020,2020,8,24,22,19.4,25.3,1.3,0
25/08/2020,2020,8,25,19.3,19.4,23.2,2,0
26/08/2020,2020,8,26,19.3,19.4,23.2,2,0
27/08/2020,2020,8,27,19.3,19.4,23.2,2,0
28/08/2020,2020,8,28,22,19.4,25.3,1.3,0
29/08/2020,2020,8,29,22,19.4,25.3,1.3,0
30/08/2020,2020,8,30,22,19.4,25.3,1.3,0
31/08/2020,2020,8,31,22,19.4,25.3,1.3,0
09/01/2020,2020,9,1,22,19.4,25.3,1.3,0
09/02/2020,2020,9,2,22,19.4,25.3,1.3,0
09/03/2020,2020,9,3,22,19.4,25.3,1.3,0
09/04/2020,2020,9,4,22,19.4,25.3,1.3,0
09/05/2020,2020,9,5,22,19.4,25.3,1.3,0
09/06/2020,2020,9,6,22,19.4,25.3,1.3,0
09/07/2020,2020,9,7,22,19.4,25.3,1.3,0
09/08/2020,2020,9,8,22,19.4,25.3,1.3,0
09/09/2020,2020,9,9,22,19.4,25.3,1.3,0
09/10/2020,2020,9,10,22,19.4,25.3,1.3,0
09/11/2020,2020,9,11,22,19.4,25.3,1.3,0
09/12/2020,2020,9,12,22,19.4,25.3,1.3,0
13/09/2020,2020,9,13,22,19.4,25.3,1.3,0
14/09/2020,2020,9,14,22,19.4,25.3,1.3,0
15/09/2020,2020,9,15,22,19.4,25.3,1.3,0
16/09/2020,2020,9,16,22,19.4,25.3,1.3,0
17/09/2020,2020,9,17,22,19.4,25.3,1.3,0
18/09/2020,2020,9,18,22,19.4,25.3,1.3,0
19/09/2020,2020,9,19,22,19.4,25.3,1.3,0
20/09/2020,2020,9,20,22,19.4,25.3,1.3,0
21/09/2020,2020,9,21,22,19.4,25.3,1.3,0
22/09/2020,2020,9,22,22,19.4,25.3,1.3,0
23/09/2020,2020,9,23,22,19.4,25.3,1.3,0
24/09/2020,2020,9,24,22,19.4,25.3,1.3,0
25/09/2020,2020,9,25,22,19.4,25.3,1.3,0
26/09/2020,2020,9,26,19.2,19.4,23.1,0.5,0
27/09/2020,2020,9,27,19.2,19.4,23.1,0.5,0
28/09/2020,2020,9,28,19.2,19.4,23.1,0.5,0
29/09/2020,2020,9,29,22,19.4,25.3,1.3,0
30/09/2020,2020,9,30,22,19.4,25.3,1.3,0
10/01/2020,2020,10,1,22,19.4,25.3,1.3,0
10/02/2020,2020,10,2,22,19.4,25.3,1.3,0
10/03/2020,2020,10,3,22,19.4,25.3,1.3,0
10/04/2020,2020,10,4,21.3,19.4,26.3,0,0
10/05/2020,2020,10,5,21.3,19.4,26.3,0,0
10/06/2020,2020,10,6,21.3,19.4,26.3,0,0
10/07/2020,2020,10,7,22,19.4,25.3,1.3,0
10/08/2020,2020,10,8,22,19.4,25.3,1.3,0
10/09/2020,2020,10,9,22,19.4,25.3,1.3,0
10/10/2020,2020,10,10,22,19.4,25.3,1.3,0
10/11/2020,2020,10,11,22,19.4,25.3,1.3,0
10/12/2020,2020,10,12,22,19.4,25.3,1.3,0
13/10/2020,2020,10,13,22,19.4,25.3,1.3,0
14/10/2020,2020,10,14,22,19.4,25.3,1.3,0
15/10/2020,2020,10,15,22,19.4,25.3,1.3,0
16/10/2020,2020,10,16,22,19.4,25.3,1.3,0
17/10/2020,2020,10,17,22,19.4,25.3,1.3,0
18/10/2020,2020,10,18,22,19.4,25.3,1.3,0
19/10/2020,2020,10,19,22,19.4,25.3,1.3,0
20/10/2020,2020,10,20,22,19.4,25.3,1.3,0
21/10/2020,2020,10,21,22,19.4,25.3,1.3,0
22/10/2020,2020,10,22,22,19.4,25.3,1.3,0
23/10/2020,2020,10,23,22,19.4,25.3,1.3,0
24/10/2020,2020,10,24,22,19.4,25.3,1.3,0
25/10/2020,2020,10,25,22,19.4,25.3,1.3,0
26/10/2020,2020,10,26,22,19.4,25.3,1.3,0
27/10/2020,2020,10,27,22,19.4,25.3,1.3,0
28/10/2020,2020,10,28,22,19.4,25.3,1.3,0
29/10/2020,2020,10,29,19.6,19.4,24.8,0,0
30/10/2020,2020,10,30,19.6,19.4,24.8,0,0
31/10/2020,2020,10,31,19.6,19.4,24.8,0,0
11/01/2020,2020,11,1,22,19.4,25.3,1.3,0
11/02/2020,2020,11,2,22,19.4,25.3,1.3,0
11/03/2020,2020,11,3,22,19.4,25.3,1.3,0
11/04/2020,2020,11,4,22,19.4,25.3,1.3,0
11/05/2020,2020,11,5,22,19.4,25.3,1.3,0
11/06/2020,2020,11,6,22,19.4,25.3,1.3,0
11/07/2020,2020,11,7,22,19.4,25.3,1.3,0
11/08/2020,2020,11,8,22,19.4,25.3,1.3,0
11/09/2020,2020,11,9,22,19.4,25.3,1.3,0
11/10/2020,2020,11,10,22,19.4,25.3,1.3,0
11/11/2020,2020,11,11,22,19.4,25.3,1.3,0
11/12/2020,2020,11,12,22,19.4,25.3,1.3,0
13/11/2020,2020,11,13,22,19.4,25.3,1.3,0
14/11/2020,2020,11,14,22,19.4,25.3,1.3,0
15/11/2020,2020,11,15,22,19.4,25.3,1.3,0
16/11/2020,2020,11,16,22,19.4,25.3,1.3,0
17/11/2020,2020,11,17,22,19.4,25.3,1.3,0
18/11/2020,2020,11,18,20.7,19.4,25.4,0.3,0
19/11/2020,2020,11,19,20.7,19.4,25.4,0.3,0
20/11/2020,2020,11,20,20.7,19.4,25.4,0.3,0
21/11/2020,2020,11,21,22,19.4,25.3,1.3,0
22/11/2020,2020,11,22,22,19.4,25.3,1.3,0
23/11/2020,2020,11,23,22,19.4,25.3,1.3,0
24/11/2020,2020,11,24,22,19.4,25.3,1.3,0
25/11/2020,2020,11,25,22,19.4,25.3,1.3,0
26/11/2020,2020,11,26,22,19.4,25.3,1.3,0
27/11/2020,2020,11,27,22,19.4,25.3,1.3,0
28/11/2020,2020,11,28,22,19.4,25.3,1.3,0
29/11/2020,2020,11,29,22,19.4,25.3,1.3,0
30/11/2020,2020,11,30,22,19.4,25.3,1.3,0
12/01/2020,2020,12,1,22,19.4,25.3,1.3,0
12/02/2020,2020,12,2,22,19.4,25.3,1.3,0
12/03/2020,2020,12,3,24.4,19.4,29.2,7.9,0
12/04/2020,2020,12,4,24.3,20.6,28.9,0,0
12/05/2020,2020,12,5,23.4,20.4,28.8,0,0
12/06/2020,2020,12,6,23.85,20.5,28.85,0,0
12/07/2020,2020,12,7,23.4,20.4,28.8,0,0
12/08/2020,2020,12,8,22,19.4,25.3,1.3,0
12/09/2020,2020,12,9,22,19.4,25.3,1.3,0
12/10/2020,2020,12,10,22,19.4,25.3,1.3,0
12/11/2020,2020,12,11,22,19.4,25.3,1.3,0
12/12/2020,2020,12,12,22,19.4,25.3,1.3,0
13/12/2020,2020,12,13,22,19.4,25.3,1.3,0
14/12/2020,2020,12,14,22,19.4,25.3,1.3,0
15/12/2020,2020,12,15,22,19.4,25.3,1.3,0
16/12/2020,2020,12,16,22,19.4,25.3,1.3,0
17/12/2020,2020,12,17,22,19.4,25.3,1.3,0
18/12/2020,2020,12,18,22,19.4,25.3,1.3,0
19/12/2020,2020,12,19,22,19.4,25.3,1.3,0
20/12/2020,2020,12,20,22,19.4,25.3,1.3,0
21/12/2020,2020,12,21,22,19.4,25.3,1.3,0
22/12/2020,2020,12,22,22,19.4,25.3,1.3,0
23/12/2020,2020,12,23,22,19.4,25.3,1.3,0
24/12/2020,2020,12,24,22,19.4,25.3,1.3,0
25/12/2020,2020,12,25,22,19.4,25.3,1.3,0
26/12/2020,2020,12,26,22,19.4,25.3,1.3,0
27/12/2020,2020,12,27,22,19.4,25.3,1.3,0
28/12/2020,2020,12,28,22,19.4,25.3,1.3,0
29/12/2020,2020,12,29,22,19.4,25.3,1.3,0
30/12/2020,2020,12,30,23.2,19.4,26.4,14,0
31/12/2020,2020,12,31,23.2,19.4,26.4,14,0
01/01/2021,2021,1,1,23.2,19.4,26.4,14,0
01/02/2021,2021,1,2,22.4,19.9,25.3,0.7,0
01/03/2021,2021,1,3,22,18.8,25.4,2.4,0
01/04/2021,2021,1,4,21.8,19.9,23.9,3.7,0
01/05/2021,2021,1,5,22.6,20.5,25.8,4.2,0
01/06/2021,2021,1,6,23,20.3,26.4,1.3,0
01/07/2021,2021,1,7,22.3,19.8,24.9,2.1,0
01/08/2021,2021,1,8,23.1,19,26.6,0,0
01/09/2021,2021,1,9,24.7,22,28.7,1,0
01/10/2021,2021,1,10,24.4,22.5,28.2,1,0
01/11/2021,2021,1,11,24.8,23.1,28.4,10.9,0
01/12/2021,2021,1,12,23.6,22.5,25.8,22.1,0
13/01/2021,2021,1,13,24.3,22.2,28.2,25.9,0
14/01/2021,2021,1,14,24.6,21.5,29.2,0,0
15/01/2021,2021,1,15,25.7,21.9,30.2,0,0
16/01/2021,2021,1,16,25.8,23.4,30,0.3,0
17/01/2021,2021,1,17,24.8,22.6,28.7,2,0
18/01/2021,2021,1,18,24.6,22.3,28.3,0.5,0
19/01/2021,2021,1,19,25.9,23.2,30.3,3,0
20/01/2021,2021,1,20,25.3,22.7,30.2,0,0
21/01/2021,2021,1,21,24.7,22.3,28.6,42.9,0
22/01/2021,2021,1,22,24.9,21.5,30.2,0,0
23/01/2021,2021,1,23,24.6,21.8,29.7,0,0
24/01/2021,2021,1,24,23.7,21.4,29,8.9,0
25/01/2021,2021,1,25,24.2,21,29.6,21.1,0
26/01/2021,2021,1,26,23.3,20.2,26.3,1.6,0
27/01/2021,2021,1,27,22.6,19.5,26.7,10.7,0
28/01/2021,2021,1,28,22.7,20.5,24.9,6.1,0
29/01/2021,2021,1,29,23.8,21.2,26.7,1,0
30/01/2021,2021,1,30,23.8,21.8,26.7,3.9,0
31/01/2021,2021,1,31,24,21.9,26.7,1.3,0
02/01/2021,2021,2,1,23.7,22.1,26.2,3.3,0
02/02/2021,2021,2,2,23.9,22.3,26.2,3.6,0
02/03/2021,2021,2,3,23.3,21.3,25.7,2.9,0
02/04/2021,2021,2,4,22.9,21.2,25.2,4.2,0
02/05/2021,2021,2,5,23.4,21.6,26.3,2,0
02/06/2021,2021,2,6,23.5,21.1,26.6,2,0
02/07/2021,2021,2,7,23.8,21.2,26.6,2.7,0
02/08/2021,2021,2,8,24.2,21.6,27.3,0.3,0
02/09/2021,2021,2,9,23.4,21.1,26.3,3.3,0
02/10/2021,2021,2,10,23.3,21,26,3.4,0
02/11/2021,2021,2,11,23.6,21.2,26.4,1.3,0
02/12/2021,2021,2,12,23.1,21.4,26,2.9,0
13/02/2021,2021,2,13,23,20.9,25.6,3.5,0
14/02/2021,2021,2,14,23,20.5,26,4.6,0
15/02/2021,2021,2,15,24.1,20.9,28.2,2.9,0
16/02/2021,2021,2,16,24.1,22.3,27.3,3.1,0
17/02/2021,2021,2,17,24.5,22.3,27.3,6,0
18/02/2021,2021,2,18,24.8,22.7,27.4,6.3,0
19/02/2021,2021,2,19,24.6,22.3,27.7,2,0
20/02/2021,2021,2,20,23.9,22.2,26.2,4.1,0
21/02/2021,2021,2,21,23.5,21.4,25.8,0.4,0
22/02/2021,2021,2,22,23.2,21.1,25.7,3.4,0
23/02/2021,2021,2,23,23.5,21.2,26.5,1.5,0
24/02/2021,2021,2,24,23.3,20.8,26,1.6,0
25/02/2021,2021,2,25,23.1,20.4,27.1,1.3,0
26/02/2021,2021,2,26,23.5,21.1,26.4,0.3,0
27/02/2021,2021,2,27,23.6,21.1,27.2,1,0
28/02/2021,2021,2,28,23.2,20.9,26.4,1.1,0
03/01/2021,2021,3,1,24.5,21.1,28.5,5.1,0
03/02/2021,2021,3,2,23.7,21.1,27,1.1,0
03/03/2021,2021,3,3,23.7,21.7,26.3,1.3,0
03/04/2021,2021,3,4,23.6,20.2,27.3,3.8,0
03/05/2021,2021,3,5,23.7,20.8,27.6,7.3,0
03/06/2021,2021,3,6,24,21.5,27.2,0,0
03/07/2021,2021,3,7,23.5,21.8,25,13.1,0
03/08/2021,2021,3,8,23.9,22.4,25.8,7.1,0
03/09/2021,2021,3,9,23.9,21.6,26.6,4,0
03/10/2021,2021,3,10,24.9,21.1,28.5,0,0
03/11/2021,2021,3,11,23.4,21.5,26.2,0.1,0
03/12/2021,2021,3,12,23.6,21.5,26.6,0.1,0
13/03/2021,2021,3,13,23.8,20.9,28.1,0.9,0
14/03/2021,2021,3,14,23.9,22.2,26.9,4.3,0
15/03/2021,2021,3,15,23.9,22,26.8,0.6,0
16/03/2021,2021,3,16,23.9,21.5,27.1,0.1,0
17/03/2021,2021,3,17,23.3,21.1,26.8,0.2,0
18/03/2021,2021,3,18,23.4,19.7,27.4,0.2,0
19/03/2021,2021,3,19,22.9,20.9,26.4,3.3,0
20/03/2021,2021,3,20,23.2,21.5,25.7,3.3,0
21/03/2021,2021,3,21,24.6,21.8,28.6,17,0
22/03/2021,2021,3,22,24.2,22,27.1,4.8,0
23/03/2021,2021,3,23,24.5,22.2,27.9,1.9,0
24/03/2021,2021,3,24,24.6,22.3,27.9,3.3,0
25/03/2021,2021,3,25,24.4,21.7,27.4,3.1,0
26/03/2021,2021,3,26,23.8,21.8,26.5,4.7,0
27/03/2021,2021,3,27,23.6,21.6,25.8,5.3,0
28/03/2021,2021,3,28,23.7,21.5,26.4,7.9,0
29/03/2021,2021,3,29,23.6,21.4,26.7,25,0
30/03/2021,2021,3,30,23.8,21.5,26.2,3.6,0
31/03/2021,2021,3,31,23.8,21.4,26.4,8,0
04/01/2021,2021,4,1,23.2,21.8,25.6,2.9,0
04/02/2021,2021,4,2,23.3,21.8,26,3.5,0
04/03/2021,2021,4,3,23.7,22,26.7,2.5,0
04/04/2021,2021,4,4,23.7,22,26.1,1.1,0
04/05/2021,2021,4,5,23.9,21.8,27.1,1.3,0
04/06/2021,2021,4,6,23.5,21.4,26.7,4.1,0
04/07/2021,2021,4,7,23.2,21.4,25.5,3.8,0
04/08/2021,2021,4,8,23.1,21.2,25.7,1.7,0
04/09/2021,2021,4,9,22.7,21.4,25.2,4.7,0
04/10/2021,2021,4,10,23.5,21.7,26.2,1.1,0
04/11/2021,2021,4,11,23.1,21.8,25.5,6.3,0
04/12/2021,2021,4,12,23,21.5,25.1,5,0
13/04/2021,2021,4,13,22.6,21.2,24.6,2.8,0
14/04/2021,2021,4,14,23,21.1,25.9,2.2,0
15/04/2021,2021,4,15,22.8,20.9,25.6,1.3,0
16/04/2021,2021,4,16,23.1,21.6,25.8,6.4,0
17/04/2021,2021,4,17,24,22,26.5,2.1,0
18/04/2021,2021,4,18,22.7,21.2,25.2,6.2,0
19/04/2021,2021,4,19,23.2,21.1,26.1,0.7,0
20/04/2021,2021,4,20,23.4,21.6,26.4,4.2,0
21/04/2021,2021,4,21,22.7,21.4,24.6,2,0
22/04/2021,2021,4,22,22.9,21.4,25.3,1.1,0
23/04/2021,2021,4,23,22.3,20.9,24.4,2.8,0
24/04/2021,2021,4,24,22.7,21.4,25,2,0
25/04/2021,2021,4,25,22.3,21.2,24.1,6.5,0
26/04/2021,2021,4,26,22.1,21,23.8,3.3,0
27/04/2021,2021,4,27,21.8,21,23.1,2.9,0
28/04/2021,2021,4,28,21.6,20.7,24,8.2,0
29/04/2021,2021,4,29,21.5,20.5,23,6.9,0
30/04/2021,2021,4,30,21.5,20.3,23.6,5.7,0
05/01/2021,2021,5,1,22.3,20.9,25,1.5,0
05/02/2021,2021,5,2,22.6,20.8,25.3,2.3,0
05/03/2021,2021,5,3,23.1,21,26.3,1.4,0
05/04/2021,2021,5,4,23.3,21.9,25.4,1.7,0
05/05/2021,2021,5,5,23.2,21.6,25.6,1.7,0
05/06/2021,2021,5,6,22.5,21,24.4,7,0
05/07/2021,2021,5,7,21.5,19.4,24.1,1.2,0
05/08/2021,2021,5,8,20.6,18.7,23.6,0,0
05/09/2021,2021,5,9,20.2,17.7,23.3,0,0
05/10/2021,2021,5,10,20.7,17.9,24.2,0,0
05/11/2021,2021,5,11,21.6,18.9,25.2,0.1,0
05/12/2021,2021,5,12,21.9,19.1,25.5,0.2,0
13/05/2021,2021,5,13,22,20.2,25.1,0.4,0
14/05/2021,2021,5,14,21.8,19.8,24.7,0.3,0
15/05/2021,2021,5,15,21.2,19.5,23.7,2,0
16/05/2021,2021,5,16,20.9,18.8,24.1,1.8,0
17/05/2021,2021,5,17,21.3,19.4,24.3,0.6,0
18/05/2021,2021,5,18,22.2,18.9,26.5,0.5,0
19/05/2021,2021,5,19,20.5,18.1,23.8,0.2,0
20/05/2021,2021,5,20,19.3,18.2,21.4,7,0
21/05/2021,2021,5,21,19.5,18.2,21.9,0.7,0
22/05/2021,2021,5,22,19.4,17.8,21.8,0.8,0
23/05/2021,2021,5,23,19.4,17.5,22.3,1.5,0
24/05/2021,2021,5,24,19.5,17.7,21.8,0.8,0
25/05/2021,2021,5,25,20,17.8,23.1,1.3,0
26/05/2021,2021,5,26,21.2,18.6,24.6,0,0
27/05/2021,2021,5,27,21.5,19.7,24.3,3.2,0
28/05/2021,2021,5,28,21.5,19.4,24.2,3.5,0
29/05/2021,2021,5,29,21.7,20.3,24.2,2.7,0
30/05/2021,2021,5,30,21.7,20.1,24.2,1.2,0
31/05/2021,2021,5,31,20.7,19.1,23,1.6,0
06/01/2021,2021,6,1,20.6,18.4,24.9,0,0
06/02/2021,2021,6,2,20.9,19.1,23.4,0.3,0
06/03/2021,2021,6,3,20.6,18.9,23.1,0,0
06/04/2021,2021,6,4,20,18.3,22,3.9,0
06/05/2021,2021,6,5,20.5,18.5,23,3,0
06/06/2021,2021,6,6,20.3,17.2,24.2,0.2,0
06/07/2021,2021,6,7,19.3,17.7,21.1,3.4,0
06/08/2021,2021,6,8,18.8,17.2,20.8,1.6,0
06/09/2021,2021,6,9,18.8,16.9,20.7,1.8,0
06/10/2021,2021,6,10,19.4,18,21.1,2.6,0
06/11/2021,2021,6,11,19.5,18.2,20.9,2.7,0
06/12/2021,2021,6,12,20,18.9,21.9,0.4,0
13/06/2021,2021,6,13,19.8,18,22.3,0.4,0
14/06/2021,2021,6,14,19.4,17.6,22.4,0.1,0
15/06/2021,2021,6,15,20.2,17.5,23.6,6.4,0
16/06/2021,2021,6,16,19.6,17,23.3,5,0
17/06/2021,2021,6,17,19.1,18,21,5.3,0
18/06/2021,2021,6,18,19.3,17.7,21.7,0.1,0
19/06/2021,2021,6,19,18.7,17,21.6,0,0
20/06/2021,2021,6,20,18.2,16.1,20.9,1,0
21/06/2021,2021,6,21,17.4,16,19.6,1.1,0
22/06/2021,2021,6,22,17.6,15.5,20.1,0.5,0
23/06/2021,2021,6,23,17.9,16.1,20.9,0.6,0
24/06/2021,2021,6,24,17,15,18.9,2.9,0
25/06/2021,2021,6,25,17.9,15.1,21.4,0.4,0
26/06/2021,2021,6,26,18.6,16.3,21.6,3,0
27/06/2021,2021,6,27,19.4,17.8,21.4,2.4,0
28/06/2021,2021,6,28,19.3,17.8,22,0.2,0
29/06/2021,2021,6,29,19.1,17.2,22.2,1.3,0
30/06/2021,2021,6,30,19.3,17.9,21.6,1.4,0
07/01/2021,2021,7,1,19,17.4,21.4,1,0
07/02/2021,2021,7,2,19,16.7,21.9,0,0
07/03/2021,2021,7,3,19,17.6,21.1,2.4,0
07/04/2021,2021,7,4,18.9,16.7,21.3,0.4,0
07/05/2021,2021,7,5,19.2,17.6,22.1,0.2,0
07/06/2021,2021,7,6,18.9,17.6,21.1,2.2,0
07/07/2021,2021,7,7,18.7,17.2,21.1,5.1,0
07/08/2021,2021,7,8,19.8,18.3,23,7.9,0
07/09/2021,2021,7,9,18.6,17.4,20.1,6.7,0
07/10/2021,2021,7,10,18.6,17.3,21.2,1.9,0
07/11/2021,2021,7,11,18.2,16.5,20.7,0.3,0
07/12/2021,2021,7,12,17.9,16.6,20.4,1.6,0
13/07/2021,2021,7,13,17.7,16.2,19.7,2.3,0
14/07/2021,2021,7,14,17.7,16.1,19.9,4.3,0
15/07/2021,2021,7,15,17.8,16,20.7,1.1,0
16/07/2021,2021,7,16,17.7,16,20.1,3.8,0
17/07/2021,2021,7,17,17.8,16.7,20,5,0
18/07/2021,2021,7,18,18.1,16.8,19.9,3.7,0
19/07/2021,2021,7,19,18.2,16.2,21,1.6,0
20/07/2021,2021,7,20,17.8,16.2,20.4,5.7,0
21/07/2021,2021,7,21,17.6,16,19.6,3.8,0
22/07/2021,2021,7,22,17.7,15.2,20.3,1.1,0
23/07/2021,2021,7,23,17.8,15.7,20.6,0.7,0
24/07/2021,2021,7,24,18.1,16.2,21.1,0,0
25/07/2021,2021,7,25,17.9,16.2,21,1.4,0
26/07/2021,2021,7,26,17.4,15.3,20.5,1.2,0
27/07/2021,2021,7,27,17.4,16.1,19.4,3,0
28/07/2021,2021,7,28,17.4,16.8,18.9,37.2,0
29/07/2021,2021,7,29,17.5,16,19.6,10,0
30/07/2021,2021,7,30,17.4,15.7,19.8,2.6,0
31/07/2021,2021,7,31,17.4,15.9,19.7,0.5,0
08/01/2021,2021,8,1,17.6,16.2,20.2,1.3,0
08/02/2021,2021,8,2,17,14,19.8,1.2,0
08/03/2021,2021,8,3,16.6,13.1,20.7,0,0
08/04/2021,2021,8,4,16.6,14.5,18.8,4.3,0
08/05/2021,2021,8,5,17,15.3,19.6,0,0
08/06/2021,2021,8,6,17,15.1,19.7,0.4,0
08/07/2021,2021,8,7,18.1,15.7,20.9,0,0
08/08/2021,2021,8,8,18.5,16.3,21.3,2.6,0
08/09/2021,2021,8,9,18.9,17.4,21.8,2.8,0
08/10/2021,2021,8,10,20.1,17.5,24.4,4.1,0
08/11/2021,2021,8,11,20.3,17.7,24.7,5.1,0
08/12/2021,2021,8,12,19.2,17.7,21.4,1,0
13/08/2021,2021,8,13,19,16.3,21.7,0.3,0
14/08/2021,2021,8,14,18.3,15,22.3,1.7,0
15/08/2021,2021,8,15,17.1,15.2,19.5,1.2,0
16/08/2021,2021,8,16,16.7,14.5,19.4,0.8,0
17/08/2021,2021,8,17,17,15.1,20.2,1.5,0
18/08/2021,2021,8,18,17.7,15.9,20.2,0.5,0
19/08/2021,2021,8,19,18.2,16.5,21.3,0,0
20/08/2021,2021,8,20,18.6,15.4,22.6,0.2,0
21/08/2021,2021,8,21,18.7,16.6,21.7,3.2,0
22/08/2021,2021,8,22,18.1,15.3,22.6,0.3,0
23/08/2021,2021,8,23,17.1,14.8,20.6,0.6,0
24/08/2021,2021,8,24,17.3,15.4,20,0.6,0
25/08/2021,2021,8,25,17.3,15.1,20.3,1.6,0
26/08/2021,2021,8,26,17.8,15.2,21.3,0,0
27/08/2021,2021,8,27,18.1,16,19.9,29.2,0
28/08/2021,2021,8,28,18.7,17.9,20,27.6,0
29/08/2021,2021,8,29,18.7,17.9,20,11.2,0
30/08/2021,2021,8,30,18.6,17.1,21.2,0.1,0
31/08/2021,2021,8,31,18.5,16.3,21.6,0.2,0
09/01/2021,2021,9,1,18.2,15.7,21,0.2,0
09/02/2021,2021,9,2,18.2,16.5,20.8,0.4,0
09/03/2021,2021,9,3,17.7,16,20.4,0.7,0
09/04/2021,2021,9,4,17.9,16,20.4,0,0
09/05/2021,2021,9,5,18.5,16.5,21.8,0.5,0
09/06/2021,2021,9,6,17.8,15.9,20.5,0.5,0
09/07/2021,2021,9,7,17.5,15.1,20.8,2.2,0
09/08/2021,2021,9,8,17.6,15.3,20.3,1.2,0
09/09/2021,2021,9,9,18.3,15.9,21.3,0.6,0
09/10/2021,2021,9,10,18.8,16.1,22.4,0,0
09/11/2021,2021,9,11,18.6,16.3,21.4,3.7,0
09/12/2021,2021,9,12,18.7,17.1,21.1,4.1,0
13/09/2021,2021,9,13,18.2,16.5,20.9,6.5,0
14/09/2021,2021,9,14,18.5,16.8,21.1,1.3,0
15/09/2021,2021,9,15,18.7,16.4,21.5,0.6,0
16/09/2021,2021,9,16,18.8,16.6,21.5,2.6,0
17/09/2021,2021,9,17,19.5,17.7,22.4,3.2,0
18/09/2021,2021,9,18,19.3,17.2,22,3.3,0
19/09/2021,2021,9,19,18.3,16.3,21.6,0.8,0
20/09/2021,2021,9,20,17.3,14.6,20.6,2,0
21/09/2021,2021,9,21,17.8,15.7,20.9,0,0
22/09/2021,2021,9,22,18,15.2,22,0.9,0
23/09/2021,2021,9,23,18.7,16.2,22.2,1.2,0
24/09/2021,2021,9,24,19.5,17.5,22.5,1.9,0
25/09/2021,2021,9,25,18.8,17.1,21.6,3,0
26/09/2021,2021,9,26,19.1,17.3,21.9,3,0
27/09/2021,2021,9,27,19.1,17.3,21.9,2.3,0
28/09/2021,2021,9,28,18.7,16.4,21.9,0.1,0
29/09/2021,2021,9,29,19,16.6,21.7,0.2,0
30/09/2021,2021,9,30,19,17,22.1,0.7,0
10/01/2021,2021,10,1,19.1,17,22,0.4,0
10/02/2021,2021,10,2,19.3,17.1,22.6,0.8,0
10/03/2021,2021,10,3,19,16.9,21.4,2.6,0
10/04/2021,2021,10,4,19,17.3,21.7,3.4,0
10/05/2021,2021,10,5,19.4,16.9,22.3,7.5,0
10/06/2021,2021,10,6,19.4,17.4,22.2,6.3,0
10/07/2021,2021,10,7,19.6,17.6,22.3,1,0
10/08/2021,2021,10,8,18.7,17,21.6,6.7,0
10/09/2021,2021,10,9,18.6,16.4,21,1.6,0
10/10/2021,2021,10,10,19.6,17.5,21.5,4.1,0
10/11/2021,2021,10,11,20.8,19.3,22.9,5.9,0
10/12/2021,2021,10,12,21.5,19,24.9,1.3,0
13/10/2021,2021,10,13,20.5,18.6,22.7,7.7,0
14/10/2021,2021,10,14,20.3,18.1,23.4,0,0
15/10/2021,2021,10,15,19.9,17.8,22.8,0.7,0
16/10/2021,2021,10,16,19.6,17.4,22.5,3.4,0
17/10/2021,2021,10,17,20,17.6,23.3,1.5,0
18/10/2021,2021,10,18,20.2,17.9,23.1,0.1,0
19/10/2021,2021,10,19,20.2,17.9,23.6,0.8,0
20/10/2021,2021,10,20,20.4,17.8,23.9,0.5,0
21/10/2021,2021,10,21,20.6,17.7,24.1,2,0
22/10/2021,2021,10,22,21.5,19,25,4.3,0
23/10/2021,2021,10,23,21.5,19.4,24.9,2.9,0
24/10/2021,2021,10,24,21.2,18.8,24.9,0.3,0
25/10/2021,2021,10,25,20.7,18.4,24,0.4,0
26/10/2021,2021,10,26,20.1,17.8,23.3,2.4,0
27/10/2021,2021,10,27,20.5,17.8,24.5,0.2,0
28/10/2021,2021,10,28,20.9,16.6,25.6,0.1,0
29/10/2021,2021,10,29,20.2,18.6,23.1,16,0
30/10/2021,2021,10,30,20.4,18.8,22.8,4.2,0
31/10/2021,2021,10,31,20.5,17.4,23.2,2.2,0
11/01/2021,2021,11,1,20.3,17.9,23.5,4,0
11/02/2021,2021,11,2,21.7,18.4,26.5,0,0
11/03/2021,2021,11,3,21.8,18.8,26.5,0,0
11/04/2021,2021,11,4,21.2,18.5,24.7,0.8,0
11/05/2021,2021,11,5,21.8,17.8,26.2,0.9,0
11/06/2021,2021,11,6,22.5,19.7,25.9,0.5,0
11/07/2021,2021,11,7,22.7,19.9,26.4,0.5,0
11/08/2021,2021,11,8,22,20.4,24.7,15.6,0
11/09/2021,2021,11,9,21.6,19.5,24.4,8.2,0
11/10/2021,2021,11,10,21,18.7,24,0.3,0
11/11/2021,2021,11,11,21.8,18.5,26.7,7.5,0
11/12/2021,2021,11,12,22.2,19.2,26.4,1.1,0
13/11/2021,2021,11,13,22.1,19.1,25.6,1.3,0
14/11/2021,2021,11,14,22.5,19.7,26.1,0.3,0
15/11/2021,2021,11,15,22.8,19.6,26.7,0,0
16/11/2021,2021,11,16,22.7,19.4,26.8,1.7,0
17/11/2021,2021,11,17,22.4,19.3,26.1,0,0
18/11/2021,2021,11,18,22.1,19.4,25.4,0.9,0
19/11/2021,2021,11,19,22,19.5,25.9,1,0
20/11/2021,2021,11,20,22.4,18.8,26.6,0,0
21/11/2021,2021,11,21,22.5,18.8,27.5,2.4,0
22/11/2021,2021,11,22,21.8,18.8,26.1,10.6,0
23/11/2021,2021,11,23,21.6,19,24.9,4.1,0
24/11/2021,2021,11,24,22.2,19.2,25.7,0.7,0
25/11/2021,2021,11,25,22.3,19.1,26.5,0.6,0
26/11/2021,2021,11,26,22.3,18.4,26.3,7.5,0
27/11/2021,2021,11,27,22.9,19.6,26.8,2.7,0
28/11/2021,2021,11,28,22.3,19.6,25.4,7.2,0
29/11/2021,2021,11,29,22.5,19.3,27,1.2,0
30/11/2021,2021,11,30,22.7,19.5,25.6,1.7,0
12/01/2021,2021,12,1,22.8,19.8,26.7,0.5,0
12/02/2021,2021,12,2,23.1,19.9,26.4,4.6,0
12/03/2021,2021,12,3,23.7,20.9,27.7,2.4,0
12/04/2021,2021,12,4,23.8,21.2,27.3,0,0
12/05/2021,2021,12,5,23.5,20.4,27.6,1.3,0
12/06/2021,2021,12,6,22.9,20.1,26.8,1.5,0
12/07/2021,2021,12,7,22.9,19.9,26.6,1,0
12/08/2021,2021,12,8,22.9,19.6,26.2,3.1,0
12/09/2021,2021,12,9,23.2,19.8,26.8,0.5,0
12/10/2021,2021,12,10,23.4,19.6,27.5,0,0
12/11/2021,2021,12,11,23.9,20.4,28.2,2.2,0
12/12/2021,2021,12,12,24,21.2,28.2,1,0
13/12/2021,2021,12,13,22.5,20,26.1,6.1,0
14/12/2021,2021,12,14,22.8,20.3,25.3,2.4,0
15/12/2021,2021,12,15,21.9,19.9,25,5.3,0
16/12/2021,2021,12,16,21.7,19.3,24.9,5,0
17/12/2021,2021,12,17,22.3,19.7,26.2,11.9,0
18/12/2021,2021,12,18,22.3,19.3,24.8,7,0
19/12/2021,2021,12,19,23.6,20.2,27.4,0,0
20/12/2021,2021,12,20,23.8,21.6,26.6,4.8,0
21/12/2021,2021,12,21,22.9,21.4,24.9,16.3,0
22/12/2021,2021,12,22,22.7,21.3,24.4,3.3,0
23/12/2021,2021,12,23,23.6,21.8,26.2,6.3,0
24/12/2021,2021,12,24,24,22.3,26.1,0.6,0
25/12/2021,2021,12,25,24.1,21.4,26.6,0,0
26/12/2021,2021,12,26,24.2,22.2,28,4.1,0
27/12/2021,2021,12,27,22.9,21.4,25.7,96.8,0
28/12/2021,2021,12,28,22.9,20.9,25.3,17.1,0
29/12/2021,2021,12,29,22,20,24.6,0.3,0
30/12/2021,2021,12,30,21.7,19.1,24.6,5.4,0
31/12/2021,2021,12,31,21.9,19.4,24.9,0,0
01/01/2022,2022,1,1,21.8,19.2,24.7,1.7,0
01/02/2022,2022,1,2,22.2,19.7,25.8,6.5,0
01/03/2022,2022,1,3,23.3,19.5,27.5,0.6,0
01/04/2022,2022,1,4,23,20.8,26.1,13.7,0
01/05/2022,2022,1,5,23.4,21.2,25.8,5.6,0
01/06/2022,2022,1,6,24.1,21.4,29.1,1,0
01/07/2022,2022,1,7,22.2,20.5,24.1,21.5,0
01/08/2022,2022,1,8,23,21,26,10.1,0
01/09/2022,2022,1,9,23.1,20.6,26,16.5,0
01/10/2022,2022,1,10,22.6,20.6,25.3,20.7,0
01/11/2022,2022,1,11,22.4,21.3,25.3,14.6,0
01/12/2022,2022,1,12,23.6,22,26,3.2,0
13/01/2022,2022,1,13,24,22,26.7,2.5,0
14/01/2022,2022,1,14,23.7,22,26.6,3,0
15/01/2022,2022,1,15,24.3,22.2,27,1.8,0
16/01/2022,2022,1,16,24.7,22.3,27.8,0.5,0
17/01/2022,2022,1,17,24.4,22.2,26.7,2.1,0
18/01/2022,2022,1,18,24.8,22.2,28,5.2,0
19/01/2022,2022,1,19,24,21.6,27.2,11.7,0
20/01/2022,2022,1,20,24.1,22.1,26.6,9.1,0
21/01/2022,2022,1,21,24.3,22.7,26.9,5.7,0
22/01/2022,2022,1,22,24.6,22.9,27.3,3.9,0
23/01/2022,2022,1,23,24.5,22.7,27.6,2.2,0
24/01/2022,2022,1,24,23.1,21.4,25.2,5.1,0
25/01/2022,2022,1,25,22.2,20,25.3,0.3,0
26/01/2022,2022,1,26,21.5,19.2,24.3,0.6,0
27/01/2022,2022,1,27,22,18.6,25.8,0.1,0
28/01/2022,2022,1,28,23.6,19.3,28.3,0.3,0
29/01/2022,2022,1,29,25.7,22.1,30.1,0,0
30/01/2022,2022,1,30,24.3,21.6,27.7,1.4,0
31/01/2022,2022,1,31,24.3,22.1,27.6,3.7,0
02/01/2022,2022,2,1,23.6,21.9,25.3,0.5,0
02/02/2022,2022,2,2,23.2,22.4,25.3,83.5,0
02/03/2022,2022,2,3,22.8,22.1,23.9,74.4,0
02/04/2022,2022,2,4,23.2,21.9,25.3,16.9,0
02/05/2022,2022,2,5,23.1,21.6,25.8,11.1,0
02/06/2022,2022,2,6,23.5,21.1,25.9,2.1,0
02/07/2022,2022,2,7,23.1,21.1,25.6,3,0
02/08/2022,2022,2,8,22.6,20.5,25.1,3.8,0
02/09/2022,2022,2,9,22.2,19.8,24.7,5,0
02/10/2022,2022,2,10,22.5,19.3,26.6,2.5,0
02/11/2022,2022,2,11,22.9,20.2,25.5,7.7,0
02/12/2022,2022,2,12,23.1,19.6,26.2,5,0
13/02/2022,2022,2,13,23.6,20.7,26.7,2.2,0
14/02/2022,2022,2,14,24,22.6,26.4,3.6,0
15/02/2022,2022,2,15,24.3,22.2,26.8,3.6,0
16/02/2022,2022,2,16,23.4,21.9,25.7,3.7,0
17/02/2022,2022,2,17,24.4,21.4,27.7,4.1,0
18/02/2022,2022,2,18,23.6,21.8,25.8,4.3,0
19/02/2022,2022,2,19,22.7,21.8,24.1,73.6,0
20/02/2022,2022,2,20,23.1,22.2,24.8,26.5,0
21/02/2022,2022,2,21,23.5,22.3,25.4,9,0
22/02/2022,2022,2,22,23.9,22.1,26.4,5.9,0
23/02/2022,2022,2,23,24.1,22.5,26.8,3.3,0
24/02/2022,2022,2,24,23.7,22.1,26,5.7,0
25/02/2022,2022,2,25,23.6,21.5,26.2,9.5,0
26/02/2022,2022,2,26,23.4,21.9,26,3.9,0
27/02/2022,2022,2,27,22.6,20.2,24.9,4.4,0
28/02/2022,2022,2,28,23.4,20.9,26.3,3.4,0
03/01/2022,2022,3,1,23.5,21.4,26.6,4.1,0
03/02/2022,2022,3,2,24.3,22.2,27.2,2.1,0
03/03/2022,2022,3,3,23.9,22.2,26,7.8,0
03/04/2022,2022,3,4,23.7,21.7,26.7,9.3,0
03/05/2022,2022,3,5,23.2,22,25.5,4.9,0
03/06/2022,2022,3,6,23.5,21.8,25.7,4.7,0
03/07/2022,2022,3,7,23.5,21.7,25.9,1.8,0
03/08/2022,2022,3,8,24,21.9,26.9,1.8,0
03/09/2022,2022,3,9,23.6,21.7,26.2,9.4,0
03/10/2022,2022,3,10,23.7,21.8,26.7,2.5,0
03/11/2022,2022,3,11,23.2,21.5,25.8,2.3,0
03/12/2022,2022,3,12,23.1,21.3,25.6,2.8,0
13/03/2022,2022,3,13,22.7,21.4,25,5.9,0
14/03/2022,2022,3,14,23.1,21.4,25.5,4.2,0
15/03/2022,2022,3,15,23.3,21.5,25.6,4.7,0
16/03/2022,2022,3,16,23.8,21.8,26.7,28.3,0
17/03/2022,2022,3,17,24,22.4,26.1,9.1,0
18/03/2022,2022,3,18,24.1,22.4,26.6,2.1,0
19/03/2022,2022,3,19,23.3,22,25.2,4.1,0
20/03/2022,2022,3,20,23.4,21.9,25.3,3.1,0
21/03/2022,2022,3,21,23.5,21.9,25.7,21.9,0
22/03/2022,2022,3,22,23.6,22,26,4.8,0
23/03/2022,2022,3,23,24,22.3,27,0.9,0
24/03/2022,2022,3,24,23.7,21.9,26.7,0.3,0
25/03/2022,2022,3,25,23.7,21.5,26.5,2.1,0
26/03/2022,2022,3,26,23.8,21.7,26.3,2.9,0
27/03/2022,2022,3,27,23.8,21.7,27,1,0
28/03/2022,2022,3,28,23.4,21.1,26.5,8.2,0
29/03/2022,2022,3,29,22.9,19.7,26.7,0,0
30/03/2022,2022,3,30,22.1,20.8,24.6,13,0
31/03/2022,2022,3,31,22.1,20.4,24.3,6.2,0
04/01/2022,2022,4,1,21.6,19.6,23.9,12,0
04/02/2022,2022,4,2,21.6,20.7,22.9,17,0
04/03/2022,2022,4,3,22.4,20.9,24.2,5.3,0
04/04/2022,2022,4,4,23.1,21.7,25.4,0.8,0
04/05/2022,2022,4,5,22.9,21.5,24.8,4.4,0
04/06/2022,2022,4,6,22.7,21.2,25,1.1,0
04/07/2022,2022,4,7,22.5,20.6,25.4,1.1,0
04/08/2022,2022,4,8,22.3,21,24.4,2.8,0
04/09/2022,2022,4,9,22.7,20.8,25.3,0.6,0
04/10/2022,2022,4,10,22.4,20.9,24.8,2.3,0
04/11/2022,2022,4,11,22.1,20.3,24.8,2.8,0
04/12/2022,2022,4,12,22,20.9,24.1,6.8,0
13/04/2022,2022,4,13,21.9,20.5,23.9,8,0
14/04/2022,2022,4,14,22,20.5,24.5,6.6,0
15/04/2022,2022,4,15,22.1,20.2,24.4,3,0
16/04/2022,2022,4,16,22.7,20.2,25.7,8.9,0
17/04/2022,2022,4,17,23.2,21.6,25.4,0.3,0
18/04/2022,2022,4,18,23.8,22.2,27.5,4.1,0
19/04/2022,2022,4,19,24.1,22,27.5,3,0
20/04/2022,2022,4,20,24.6,22.8,28.4,2,0
21/04/2022,2022,4,21,23.8,21.6,28.9,0,0
22/04/2022,2022,4,22,22.4,20.5,26.4,0.8,0
23/04/2022,2022,4,23,21.4,19.1,25.2,3,0
24/04/2022,2022,4,24,20.8,18.3,24.5,4.1,0
25/04/2022,2022,4,25,21.1,19.5,24.9,11.9,0
26/04/2022,2022,4,26,22.3,19.5,26,7.1,0
27/04/2022,2022,4,27,22.1,20.1,26.4,2,0
28/04/2022,2022,4,28,22.4,18.6,27.1,1,0
29/04/2022,2022,4,29,22.7,20.5,27,0,0
30/04/2022,2022,4,30,22.4,19.7,26.2,0,0
05/01/2022,2022,5,1,23.1,20.1,27.2,0,0
05/02/2022,2022,5,2,23.2,18.5,27.7,0,0
05/03/2022,2022,5,3,23.1,20.3,27.4,0.5,0
05/04/2022,2022,5,4,22.6,19.9,26,2,0
05/05/2022,2022,5,5,21.9,21.4,23.8,6.1,0
05/06/2022,2022,5,6,21.1,19.6,23.1,5.6,0
05/07/2022,2022,5,7,21.3,16.8,25.7,3,0
05/08/2022,2022,5,8,22.4,20,26.6,2,0
05/09/2022,2022,5,9,22.8,18.8,27.5,0,0
05/10/2022,2022,5,10,22.7,20.4,26.7,0,0
05/11/2022,2022,5,11,22.6,20.1,26.6,0,0
05/12/2022,2022,5,12,21.7,20.2,25.8,0.3,0
13/05/2022,2022,5,13,21.6,19.6,25,8.9,0
14/05/2022,2022,5,14,21.4,19.1,25.1,0,0
15/05/2022,2022,5,15,21.7,19.5,26.5,0,0
16/05/2022,2022,5,16,21.2,19.8,24.9,11.9,0
17/05/2022,2022,5,17,20.3,18.5,23.6,6.1,0
18/05/2022,2022,5,18,20.2,17,23.1,2,0
19/05/2022,2022,5,19,20.8,18.5,24.4,0.3,0
20/05/2022,2022,5,20,20.9,19.5,23.5,6.1,0
21/05/2022,2022,5,21,20.7,18.6,24.5,7.1,0
22/05/2022,2022,5,22,20.7,17.2,24.4,5.1,0
23/05/2022,2022,5,23,20.2,18.2,24,0,0
24/05/2022,2022,5,24,21.2,18.7,24.8,6.1,0
25/05/2022,2022,5,25,21.2,18.5,25.5,0,0
26/05/2022,2022,5,26,22.6,18.6,26.1,0,0
27/05/2022,2022,5,27,20.8,15.3,27.4,0,0
28/05/2022,2022,5,28,21.1,17.3,24.9,0,0
29/05/2022,2022,5,29,19.8,18.3,23.1,0,0
30/05/2022,2022,5,30,19.4,17.3,23.5,2,0
31/05/2022,2022,5,31,20,17.3,23,14,0
06/01/2022,2022,6,1,19.2,15.5,24.1,0.8,0
06/02/2022,2022,6,2,20.2,16.5,25.5,0,0
06/03/2022,2022,6,3,20.3,17.8,24.4,0.2,0
06/04/2022,2022,6,4,20.1,18.7,22.6,8.9,0
06/05/2022,2022,6,5,19.6,18,23.4,20.1,0
06/06/2022,2022,6,6,19.8,17.6,23.4,0.5,0
06/07/2022,2022,6,7,20.2,17.6,23.1,3,0
06/08/2022,2022,6,8,20.8,18.1,25.1,0,0
06/09/2022,2022,6,9,19.2,17.7,21,1,0
06/10/2022,2022,6,10,18.5,17,20.7,1.9,0
06/11/2022,2022,6,11,18.8,17.1,21.1,0.5,0
06/12/2022,2022,6,12,18.6,17.6,20.2,0,0
13/06/2022,2022,6,13,19,17.8,20.7,4.7,0
14/06/2022,2022,6,14,19.6,17.6,23.6,0,0
15/06/2022,2022,6,15,18.7,17.6,22.3,0,0
16/06/2022,2022,6,16,19.7,17.8,23.8,3,0
17/06/2022,2022,6,17,19.6,16.6,24.4,0,0
18/06/2022,2022,6,18,19.3,14.3,25,0,0
19/06/2022,2022,6,19,19.3,15.5,23.1,0,0
20/06/2022,2022,6,20,18.9,16.1,22.3,1,0
21/06/2022,2022,6,21,18.4,15.6,21.6,5.1,0
22/06/2022,2022,6,22,18.2,13.5,23,0,0
23/06/2022,2022,6,23,17.9,15.5,21.7,3,0
24/06/2022,2022,6,24,18,15.7,20.7,4.1,0
25/06/2022,2022,6,25,18.2,16,21,0,0
26/06/2022,2022,6,26,17.9,14.6,22,0.5,0
27/06/2022,2022,6,27,18,11.9,23.1,0,0
28/06/2022,2022,6,28,17.9,16.2,21,0.8,0
29/06/2022,2022,6,29,17.2,15.3,20.4,3,0
30/06/2022,2022,6,30,17.1,15.2,20.6,5.1,0
07/01/2022,2022,7,1,16.8,15.8,20.1,11.9,0
07/02/2022,2022,7,2,18.1,15.6,21.1,7.1,0
07/03/2022,2022,7,3,18.2,16.7,20.6,2.4,0
07/04/2022,2022,7,4,17.7,16.2,21.2,11.9,0
07/05/2022,2022,7,5,18,16,21.4,5.1,0
07/06/2022,2022,7,6,16.9,15.4,19.6,2,0
07/07/2022,2022,7,7,17.7,16.4,20.4,0,0
07/08/2022,2022,7,8,17.7,15.4,20.9,4.1,0
07/09/2022,2022,7,9,16.6,15.4,19.4,5.1,0
07/10/2022,2022,7,10,17.3,15.3,20.1,7.1,0
07/11/2022,2022,7,11,18.4,16.6,22,2,0
07/12/2022,2022,7,12,18.2,16.6,21.7,5.1,0
13/07/2022,2022,7,13,17.8,16,21.5,2,0
14/07/2022,2022,7,14,17.5,15.6,20.9,7.1,0
15/07/2022,2022,7,15,18.7,15.6,22.8,4.1,0
16/07/2022,2022,7,16,18.1,16.2,20.9,0,0
17/07/2022,2022,7,17,17.4,15.8,19.6,2,0
18/07/2022,2022,7,18,17,15.7,18.9,10.9,0
19/07/2022,2022,7,19,17.3,15.9,19.9,11.9,0
20/07/2022,2022,7,20,17.1,15.5,19.4,1.8,0
21/07/2022,2022,7,21,17.5,15.1,21.5,7.1,0
22/07/2022,2022,7,22,17.6,16,21,11.9,0
23/07/2022,2022,7,23,17.2,16.2,21,10.9,0
24/07/2022,2022,7,24,18,16.1,21.6,11.9,0
25/07/2022,2022,7,25,18.1,14.3,22.5,0,0
26/07/2022,2022,7,26,18.8,15.5,22,0.2,0
27/07/2022,2022,7,27,19.2,16.5,22.7,0,0
28/07/2022,2022,7,28,19,16.1,22.8,0,0
29/07/2022,2022,7,29,17.9,16.2,22.2,0.5,0
30/07/2022,2022,7,30,17.6,16.1,19.6,3.1,0
31/07/2022,2022,7,31,18,16.1,20.8,6.1,0
08/01/2022,2022,8,1,18.5,16.4,22.9,1,0
08/02/2022,2022,8,2,18.6,15.6,23.4,2,0
08/03/2022,2022,8,3,17.6,14.7,21.5,1,0
08/04/2022,2022,8,4,18.1,14.2,22.4,0.3,0
08/05/2022,2022,8,5,17.7,15.8,20.5,0.1,0
08/06/2022,2022,8,6,18.3,15.4,22.9,2,0
08/07/2022,2022,8,7,18.5,16.6,23.5,2,0
08/08/2022,2022,8,8,18.5,15.2,23.5,0,0
08/09/2022,2022,8,9,18.6,16.1,22.3,0.3,0
08/10/2022,2022,8,10,17,15.4,19.5,0.2,0
08/11/2022,2022,8,11,17.4,14.8,20.9,2,0
08/12/2022,2022,8,12,17,15.2,20.2,2.2,0
13/08/2022,2022,8,13,16.6,14.6,20.3,2,0
14/08/2022,2022,8,14,17.2,15,20.3,1.1,0
15/08/2022,2022,8,15,17.9,15.7,21.7,3,0
16/08/2022,2022,8,16,18.6,15.9,23.3,2,0
17/08/2022,2022,8,17,18.5,15.6,22.2,0.3,0
18/08/2022,2022,8,18,18.8,16.7,23.4,0,0
19/08/2022,2022,8,19,18.9,16.6,23,0.5,0
20/08/2022,2022,8,20,18.9,16.4,22.7,0.3,0
21/08/2022,2022,8,21,18.6,16,23.6,0,0
22/08/2022,2022,8,22,18.8,16.4,21.9,0,0
23/08/2022,2022,8,23,19.3,17,23.3,1,0
24/08/2022,2022,8,24,18.8,16.3,22.2,0,0
25/08/2022,2022,8,25,17.3,15.3,22.1,0,0
26/08/2022,2022,8,26,18,15.9,22.8,2,0
27/08/2022,2022,8,27,19,16.1,22.9,0.5,0
28/08/2022,2022,8,28,19,17.4,21.4,2.3,0
29/08/2022,2022,8,29,18.9,16.9,21.3,2,0
30/08/2022,2022,8,30,20.1,16.2,24.5,0.5,0
31/08/2022,2022,8,31,20.1,15.5,23.6,0,0
09/01/2022,2022,9,1,19.2,15.2,24.4,0,0
09/02/2022,2022,9,2,18.9,16.3,24.2,0,0
09/03/2022,2022,9,3,17.8,15.5,22.6,2,0
09/04/2022,2022,9,4,18.6,16.6,22.6,7.9,0
09/05/2022,2022,9,5,18.3,16.8,22,8.9,0
09/06/2022,2022,9,6,18.1,16.5,21.9,2,0
09/07/2022,2022,9,7,18.8,15.4,23.4,0,0
09/08/2022,2022,9,8,18.9,15.9,23,0.5,0
09/09/2022,2022,9,9,17.8,15.8,20.3,0.4,0
09/10/2022,2022,9,10,18.5,15.9,22.6,1,0
09/11/2022,2022,9,11,18.7,15.5,22.5,0,0
09/12/2022,2022,9,12,18.9,15.7,23.6,0,0
13/09/2022,2022,9,13,19.3,15.4,22.9,0,0
14/09/2022,2022,9,14,19.6,16.9,25.1,0.3,0
15/09/2022,2022,9,15,19.5,16.9,23.6,0.5,0
16/09/2022,2022,9,16,19.6,17,23.5,0.3,0
17/09/2022,2022,9,17,18.6,16.6,21.1,3.1,0
18/09/2022,2022,9,18,18.9,16.7,21.5,6.1,0
19/09/2022,2022,9,19,18.1,16.4,23.3,15,0
20/09/2022,2022,9,20,18.3,16.1,21.1,4,0
21/09/2022,2022,9,21,18.9,17,21.5,0.7,0
22/09/2022,2022,9,22,18.9,16.7,22.2,1.3,0
23/09/2022,2022,9,23,19,17,22,1.3,0
24/09/2022,2022,9,24,18.5,16.4,21.4,3.6,0
25/09/2022,2022,9,25,18.8,16.5,22.1,0.1,0
26/09/2022,2022,9,26,18.7,16.5,21.7,1,0
27/09/2022,2022,9,27,18.7,16,22.1,0.6,0
28/09/2022,2022,9,28,18.5,15.6,22.5,0.7,0
29/09/2022,2022,9,29,18,15.5,21.2,1.1,0
30/09/2022,2022,9,30,18.7,15.6,22.4,0,0
10/01/2022,2022,10,1,18.6,15.8,22.3,0,0
10/02/2022,2022,10,2,18.8,15.5,22.5,0,0
10/03/2022,2022,10,3,18.9,16.1,23.1,0.4,0
10/04/2022,2022,10,4,19.4,16.5,23.3,0,0
10/05/2022,2022,10,5,19.1,16.4,22.8,0,0
10/06/2022,2022,10,6,18.8,16.5,21.8,1.5,0
10/07/2022,2022,10,7,19.6,16.3,23.4,2,0
10/08/2022,2022,10,8,19,16.5,22.2,0.2,0
10/09/2022,2022,10,9,19.4,15.9,23.2,0,0
10/10/2022,2022,10,10,19.1,16.2,23,0,0
10/11/2022,2022,10,11,19.2,16.5,22.4,0,0
10/12/2022,2022,10,12,19.4,16.4,23.3,0,0
13/10/2022,2022,10,13,19.2,16.2,22.9,0.2,0
14/10/2022,2022,10,14,19.2,16.2,22.8,0.4,0
15/10/2022,2022,10,15,18.9,16,22.6,1.1,0
16/10/2022,2022,10,16,19.1,16.1,22.6,0.8,0
17/10/2022,2022,10,17,19.1,16.8,22.3,0.6,0
18/10/2022,2022,10,18,19.3,15.7,23.3,0,0
19/10/2022,2022,10,19,19.3,16.3,23,0.4,0
20/10/2022,2022,10,20,19,16,22,2.3,0
21/10/2022,2022,10,21,20.1,16.8,24.2,1.9,0
22/10/2022,2022,10,22,21,18,25.3,0,0
23/10/2022,2022,10,23,20.4,16.8,24.9,10.4,0
24/10/2022,2022,10,24,20,17.4,23,3.6,0
25/10/2022,2022,10,25,20.1,17.3,23.6,0,0
26/10/2022,2022,10,26,20,17.3,23.3,0.3,0
27/10/2022,2022,10,27,20.2,17.1,24,0.7,0
28/10/2022,2022,10,28,20.3,17.1,24.4,4,0
29/10/2022,2022,10,29,19.8,16.9,24.2,7.9,0
30/10/2022,2022,10,30,22,17.3,26,0,0
31/10/2022,2022,10,31,19.8,17.6,23,2.1,0
11/01/2022,2022,11,1,20.4,18,23.6,0.5,0
11/02/2022,2022,11,2,20.1,17.6,23,3.3,0
11/03/2022,2022,11,3,20.9,17.6,24.8,0.6,0
11/04/2022,2022,11,4,21.3,17.9,25.7,4.9,0
11/05/2022,2022,11,5,20.9,18.2,24.3,3.4,0
11/06/2022,2022,11,6,20.9,18.4,24.1,3.9,0
11/07/2022,2022,11,7,20.7,17.7,23.9,0.4,0
11/08/2022,2022,11,8,21,17.9,24.8,0,0
11/09/2022,2022,11,9,21.1,17.5,24.8,0,0
11/10/2022,2022,11,10,21.7,17.6,26.8,0,0
11/11/2022,2022,11,11,22.1,17.4,27.4,0.8,0
11/12/2022,2022,11,12,21.4,17.9,26.3,0,0
13/11/2022,2022,11,13,21.9,17.4,27.3,0,0
14/11/2022,2022,11,14,20.2,18.3,22.9,11.8,0
15/11/2022,2022,11,15,19.3,17,21.8,0.1,0
16/11/2022,2022,11,16,18.8,15.5,21.7,1.2,0
17/11/2022,2022,11,17,18.7,15,22.6,2.6,0
18/11/2022,2022,11,18,19.7,14.9,24.4,0,0
19/11/2022,2022,11,19,20.2,15.9,24.8,2.8,0
20/11/2022,2022,11,20,21.3,17.2,25.1,1.3,0
21/11/2022,2022,11,21,21.9,17.6,26,0,0
22/11/2022,2022,11,22,22.8,17.6,28.4,1.5,0
23/11/2022,2022,11,23,22.7,19.3,26.1,4.3,0
24/11/2022,2022,11,24,22.3,19.4,26,0.2,0
25/11/2022,2022,11,25,21.7,18.5,25.4,1.1,0
26/11/2022,2022,11,26,21.4,18.8,24.4,1.6,0
27/11/2022,2022,11,27,21.5,18.3,25.1,0.1,0
28/11/2022,2022,11,28,22.1,18.4,26.2,0.1,0
29/11/2022,2022,11,29,21.7,18.5,24.8,4.5,0
30/11/2022,2022,11,30,22.4,18.8,26.3,0,0
12/01/2022,2022,12,1,21.6,18.8,26,11.7,0
12/02/2022,2022,12,2,20.8,18.3,23.7,12,0
12/03/2022,2022,12,3,21.2,17.9,25.2,0.5,0
12/04/2022,2022,12,4,22.2,19.2,25.8,1.1,0
12/05/2022,2022,12,5,22.3,19.5,26.1,0,0
12/06/2022,2022,12,6,22.2,19.5,25.2,4.9,0
12/07/2022,2022,12,7,22,20.1,24.7,6.2,0
12/08/2022,2022,12,8,21.8,19.9,24.3,7,0
12/09/2022,2022,12,9,21.8,20,24.1,22.8,0
12/10/2022,2022,12,10,21.9,19.6,24.8,8,0
12/11/2022,2022,12,11,22,20,24.7,0,0
12/12/2022,2022,12,12,21.8,19.7,24.9,0.1,0
13/12/2022,2022,12,13,22.6,19.4,27.1,1,0
14/12/2022,2022,12,14,22.2,19.7,25.3,1.2,0
15/12/2022,2022,12,15,22.2,20.2,24.6,3.4,0
16/12/2022,2022,12,16,22,19.5,25,0,0
17/12/2022,2022,12,17,22,19.7,25,1.7,0
18/12/2022,2022,12,18,22.5,19.9,26,0,0
19/12/2022,2022,12,19,22.7,19.9,26.5,0,0
20/12/2022,2022,12,20,22.3,19,26,2,0
21/12/2022,2022,12,21,22.7,18.9,27.2,4.6,0
22/12/2022,2022,12,22,22.8,19.2,27.4,0.2,0
23/12/2022,2022,12,23,23.5,19.3,28.6,0,0
24/12/2022,2022,12,24,24.1,19.9,29.4,0.5,0
25/12/2022,2022,12,25,23.6,20.6,27.2,1.8,0
26/12/2022,2022,12,26,23.2,19.9,27.2,0.1,0
27/12/2022,2022,12,27,22.9,20,26.6,0.5,0
28/12/2022,2022,12,28,23.2,20.2,27,0,0
29/12/2022,2022,12,29,22.4,19.6,25.3,7.8,0
30/12/2022,2022,12,30,22.2,19.6,25.4,8.8,0
31/12/2022,2022,12,31,21.8,19.1,24.6,10.3,0
01/01/2023,2023,1,1,22.2,19.4,24.8,3.9,0
01/02/2023,2023,1,2,22.1,19.6,25.3,23.3,0
01/03/2023,2023,1,3,22.7,19.9,25.2,1.9,0
01/04/2023,2023,1,4,23,20.3,26.1,0,0
01/05/2023,2023,1,5,22.6,20.3,25.2,4,0
01/06/2023,2023,1,6,22.6,20.2,25.4,2.6,0
01/07/2023,2023,1,7,22.9,20.6,25.5,0.9,0
01/08/2023,2023,1,8,24.1,19.9,27.9,0,0
01/09/2023,2023,1,9,22.6,19.9,25.6,2.3,0
01/10/2023,2023,1,10,22.5,20.1,25.2,11.7,0
01/11/2023,2023,1,11,22.4,20.3,24.9,3,0
01/12/2023,2023,1,12,22.6,20.2,25.6,0.6,0
13/01/2023,2023,1,13,22.7,20.2,25.3,3.2,0
14/01/2023,2023,1,14,22.6,20,26.2,0.5,0
15/01/2023,2023,1,15,22.9,20,26.1,3,0
16/01/2023,2023,1,16,23.4,20.8,26.7,0.8,0
17/01/2023,2023,1,17,23.1,21,25.4,1.7,0
18/01/2023,2023,1,18,23,21.4,26.1,10.4,0
19/01/2023,2023,1,19,22.9,21.4,25.4,11.5,0
20/01/2023,2023,1,20,22.5,21.5,24.5,21.8,0
21/01/2023,2023,1,21,22.9,20.7,26.1,7.9,0
22/01/2023,2023,1,22,22.9,20.8,25.6,3.3,0
23/01/2023,2023,1,23,22.5,21.1,24.8,10.9,0
24/01/2023,2023,1,24,21,19.6,22.7,31.2,0
25/01/2023,2023,1,25,21.5,20.5,23.2,36.5,0
26/01/2023,2023,1,26,21.5,20.8,22.6,71.5,0
27/01/2023,2023,1,27,22.1,21.5,23.3,27.2,0
28/01/2023,2023,1,28,22.9,21.3,25.3,21.2,0
29/01/2023,2023,1,29,24,22,26.8,2.3,0
30/01/2023,2023,1,30,23.8,21.9,25.9,4.2,0
31/01/2023,2023,1,31,23.8,21.4,26.4,9.3,0
02/01/2023,2023,2,1,23.6,21.6,26.4,0.4,0
02/02/2023,2023,2,2,23.4,21,25.7,2.6,0
02/03/2023,2023,2,3,23,21,26,6.2,0
02/04/2023,2023,2,4,23.3,21,26.2,6.4,0
02/05/2023,2023,2,5,23.2,21.4,26,5.3,0
02/06/2023,2023,2,6,23.4,21.2,26.2,2.1,0
02/07/2023,2023,2,7,24.1,21.2,27.6,2,0
02/08/2023,2023,2,8,22.9,20.7,25.5,5.5,0
02/09/2023,2023,2,9,23,20.2,25.6,5.3,0
02/10/2023,2023,2,10,22.9,20.6,25.4,3,0
02/11/2023,2023,2,11,23.1,20.9,25.8,1.1,0
02/12/2023,2023,2,12,23,20.3,25.9,0.5,0
13/02/2023,2023,2,13,22.7,20.6,25.8,2.1,0
14/02/2023,2023,2,14,22.8,20.5,25.3,2.9,0
15/02/2023,2023,2,15,22.8,20,26.1,0.8,0
16/02/2023,2023,2,16,21.9,18.8,25,8,0
17/02/2023,2023,2,17,22.3,19,26.1,3.2,0
18/02/2023,2023,2,18,22.8,20.1,25.2,3.6,0
19/02/2023,2023,2,19,23.6,21.1,26.5,3.2,0
20/02/2023,2023,2,20,23.4,22.4,24.8,13.1,0
21/02/2023,2023,2,21,23.7,22,26.1,8.7,0
22/02/2023,2023,2,22,23.7,21.8,26.2,0,0
23/02/2023,2023,2,23,23,21.1,26,2.5,0
24/02/2023,2023,2,24,22.9,20.7,25.4,2,0
25/02/2023,2023,2,25,22.7,20.6,25.6,1.8,0
26/02/2023,2023,2,26,23.1,21,25.8,4.9,0
27/02/2023,2023,2,27,23.1,19.8,27.4,9.3,0
28/02/2023,2023,2,28,22.9,21,25.5,6.8,0
03/01/2023,2023,3,1,22.7,20.6,25.4,5.3,0
03/02/2023,2023,3,2,23,19.6,26.3,1.5,0
03/03/2023,2023,3,3,25.7,20.6,29.1,0,0
03/04/2023,2023,3,4,23.2,20.4,26.6,5.5,0
03/05/2023,2023,3,5,21.8,20.7,22.9,36.7,0
03/06/2023,2023,3,6,23.1,21.3,25.4,9.8,0
03/07/2023,2023,3,7,23.4,21.3,26.5,1.6,0
03/08/2023,2023,3,8,23,21.2,25.5,3,0
03/09/2023,2023,3,9,22.9,21.1,25.5,3.6,0
03/10/2023,2023,3,10,23,21.1,25.4,6.8,0
03/11/2023,2023,3,11,22.7,20.8,25,2.3,0
03/12/2023,2023,3,12,22.6,20.1,25.2,0.2,0
13/03/2023,2023,3,13,22,20.2,24.5,2.7,0
14/03/2023,2023,3,14,23.5,20.2,27.2,0,0
15/03/2023,2023,3,15,22.1,20.3,24.2,0.6,0
16/03/2023,2023,3,16,23,20.8,26.3,0.6,0
17/03/2023,2023,3,17,23,20.8,25.6,6.1,0
18/03/2023,2023,3,18,23.2,21.7,24.9,10.9,0
19/03/2023,2023,3,19,23.8,21.3,26.6,2.1,0
20/03/2023,2023,3,20,25.6,21.1,29.5,1,0
21/03/2023,2023,3,21,24.4,21.4,29.1,8.9,0
22/03/2023,2023,3,22,23.8,20.9,29.4,0,0
23/03/2023,2023,3,23,25.1,21.9,28.6,0,0
24/03/2023,2023,3,24,24,22.2,28.8,0,0
25/03/2023,2023,3,25,24.3,20.8,29.2,0,0
26/03/2023,2023,3,26,23.6,21.3,27.4,3,0
27/03/2023,2023,3,27,23.2,21.2,25.6,3.3,0
28/03/2023,2023,3,28,23.9,18.5,29,0,0
29/03/2023,2023,3,29,24.4,21.3,28.9,0,0
30/03/2023,2023,3,30,25.4,23.1,29.4,2,0
31/03/2023,2023,3,31,25.1,22.9,28.8,4.1,0
04/01/2023,2023,4,1,24.6,22.3,28.6,0,0
04/02/2023,2023,4,2,24.2,21.3,28.9,0,0
04/03/2023,2023,4,3,24.4,21.2,29.1,3,0
04/04/2023,2023,4,4,23.3,20.6,27.9,0,0
04/05/2023,2023,4,5,22.7,19.8,28.4,30,0
04/06/2023,2023,4,6,23.7,21.2,28.8,39.9,0
04/07/2023,2023,4,7,23.3,20.1,29.8,115.1,0
04/08/2023,2023,4,8,23.7,20.9,28.4,75.9,0
04/09/2023,2023,4,9,22.8,21,25.4,1.4,0
04/10/2023,2023,4,10,23.7,20.4,27.1,0,0
04/11/2023,2023,4,11,21.9,21,23.4,10.5,0
04/12/2023,2023,4,12,24.3,21,27.4,0.5,0
13/04/2023,2023,4,13,24.1,21.1,29.1,0,0
14/04/2023,2023,4,14,22.9,20.9,25.7,3,0
15/04/2023,2023,4,15,24.3,21.3,29.2,3,0
16/04/2023,2023,4,16,23.7,20.6,28.1,0,0
17/04/2023,2023,4,17,22.8,21,26.6,0,0
18/04/2023,2023,4,18,23.9,21.6,28.2,7.1,0
19/04/2023,2023,4,19,23.7,21.9,27.2,0.5,0
20/04/2023,2023,4,20,23.1,20.5,28.2,0,0
21/04/2023,2023,4,21,22.6,20.9,24.8,1.2,0
22/04/2023,2023,4,22,23.6,21.2,27.8,0,0
23/04/2023,2023,4,23,24,20.9,28,0.3,0
24/04/2023,2023,4,24,24.1,21.5,27.9,0,0
25/04/2023,2023,4,25,23.7,20.9,28.4,0,0
26/04/2023,2023,4,26,23.7,21,28.5,43.9,0
27/04/2023,2023,4,27,23.4,21.2,27.6,3,0
28/04/2023,2023,4,28,23.6,21.3,27.2,0,0
29/04/2023,2023,4,29,23.1,20.5,27.2,0,0
30/04/2023,2023,4,30,22.4,18.8,28,0,0
05/01/2023,2023,5,1,23,19.6,28.4,0,0
05/02/2023,2023,5,2,23.4,19.6,28.1,0,0
05/03/2023,2023,5,3,23.1,20.6,27.2,0,0
05/04/2023,2023,5,4,22.6,20.8,28,0,0
05/05/2023,2023,5,5,23.3,20.6,26.9,3,0
05/06/2023,2023,5,6,22.2,20.7,25.6,23.1,0
05/07/2023,2023,5,7,22.8,20.5,25.9,19.1,0
05/08/2023,2023,5,8,22.9,20.1,26.1,18,0
05/09/2023,2023,5,9,22.9,20.4,26.8,2,0
05/10/2023,2023,5,10,22.6,20.1,26,1,0
05/11/2023,2023,5,11,21.8,20.1,25.5,50,0
05/12/2023,2023,5,12,22.2,19.6,26.5,2,0
13/05/2023,2023,5,13,22.8,20.5,27.4,2,0
14/05/2023,2023,5,14,21.6,19.7,26,2,0
15/05/2023,2023,5,15,22.8,19.1,27.8,32,0
16/05/2023,2023,5,16,22.2,20.1,25.4,0,0
17/05/2023,2023,5,17,22.9,18.9,27.1,0,0
18/05/2023,2023,5,18,22.9,18.4,29,0,0
19/05/2023,2023,5,19,22.7,20.5,27.5,4.1,0
20/05/2023,2023,5,20,22.3,19.8,28.2,0,0
21/05/2023,2023,5,21,22.1,17.6,27.3,0,0
22/05/2023,2023,5,22,20.9,18,28.3,0,0
23/05/2023,2023,5,23,23.6,19.3,27.3,0,0
24/05/2023,2023,5,24,21.9,18.5,26.6,16,0
25/05/2023,2023,5,25,20.6,18.6,25.6,0.8,0
26/05/2023,2023,5,26,18.7,18.1,20.1,10.9,0
27/05/2023,2023,5,27,21.2,18,25.9,10.9,0
28/05/2023,2023,5,28,20.7,19.5,22.8,25.9,0
29/05/2023,2023,5,29,21.7,20,25.1,16,0
30/05/2023,2023,5,30,20.6,18.3,25.3,0,0
31/05/2023,2023,5,31,20.9,18.6,25.1,0,0
06/01/2023,2023,6,1,19.6,17.7,24.5,0,0
06/02/2023,2023,6,2,20.4,18.1,24.2,0,0
06/03/2023,2023,6,3,19.9,17.2,24,1.5,0
06/04/2023,2023,6,4,21.3,18.9,25,3,0
06/05/2023,2023,6,5,21.1,20.1,23.2,6.1,0
06/06/2023,2023,6,6,21.9,19.4,25.4,8.9,0
06/07/2023,2023,6,7,21.2,18.6,26.1,2,0
06/08/2023,2023,6,8,21.3,18.6,25,7.9,0
06/09/2023,2023,6,9,21,19,23.5,0,0
06/10/2023,2023,6,10,21.2,19.3,24.5,2,0
06/11/2023,2023,6,11,21.2,16.7,24.2,0,0
06/12/2023,2023,6,12,22.1,19.9,25.2,0,0
13/06/2023,2023,6,13,21.8,19.7,26.6,7.1,0
14/06/2023,2023,6,14,21.6,19,24.5,0,0
15/06/2023,2023,6,15,20.8,19.4,23.4,0.6,0
16/06/2023,2023,6,16,21.8,18.6,25.6,0,0
17/06/2023,2023,6,17,21.6,18,26.2,0.3,0
18/06/2023,2023,6,18,20.4,17.3,23.2,0.5,0
19/06/2023,2023,6,19,19.1,17,20.9,0,0
20/06/2023,2023,6,20,19.8,16.7,22.6,0,0
21/06/2023,2023,6,21,19.5,17,23,0.1,0
22/06/2023,2023,6,22,20,17.5,23.7,2,0
23/06/2023,2023,6,23,19.2,16.4,22.8,0,0
24/06/2023,2023,6,24,18.4,14.7,22.8,0,0
25/06/2023,2023,6,25,17.3,13.6,20.3,7.9,0
26/06/2023,2023,6,26,18.3,16,21.8,0.3,0
27/06/2023,2023,6,27,17.8,12.3,23.2,0,0
28/06/2023,2023,6,28,19.4,14.3,24.2,0,0
29/06/2023,2023,6,29,18.1,16.2,20.9,0,0
30/06/2023,2023,6,30,16.8,14.7,20.4,0.5,0
07/01/2023,2023,7,1,18.3,14.4,22.3,1,0
07/02/2023,2023,7,2,18.5,15.7,22.4,0,0
07/03/2023,2023,7,3,19.8,17.3,22.8,0,0
07/04/2023,2023,7,4,19.1,16.9,21.9,2.6,0
07/05/2023,2023,7,5,19.8,16.6,22.1,4.1,0
07/06/2023,2023,7,6,20.6,17.9,24.1,0.5,0
07/07/2023,2023,7,7,20.1,17,22.7,0.5,0
07/08/2023,2023,7,8,20.1,18,24.6,1,0
07/09/2023,2023,7,9,19.6,17.8,22.7,14,0
07/10/2023,2023,7,10,19.9,16.9,22.7,5.1,0
07/11/2023,2023,7,11,18.9,15,23.4,0,0
07/12/2023,2023,7,12,19.6,16,22.9,0,0
13/07/2023,2023,7,13,18.1,14.3,23,0,0
14/07/2023,2023,7,14,19.7,16.1,24.3,0,0
15/07/2023,2023,7,15,20.4,19.2,21.6,3,0
16/07/2023,2023,7,16,20.7,19.2,22.9,0,0
17/07/2023,2023,7,17,19.5,18.6,21.7,17,0
18/07/2023,2023,7,18,19.6,18.3,21.9,0,0
19/07/2023,2023,7,19,20.4,18.5,23.3,0,0
20/07/2023,2023,7,20,20.1,17.4,23.2,1,0
21/07/2023,2023,7,21,20.3,16.5,23.8,0,0
22/07/2023,2023,7,22,20.1,17.9,23.4,0.3,0
23/07/2023,2023,7,23,19.1,17.8,20.8,7.1,0
24/07/2023,2023,7,24,20,18.4,22.9,7.9,0
25/07/2023,2023,7,25,20.2,18.4,24.1,9.9,0
26/07/2023,2023,7,26,19.5,16,24.9,0,0
27/07/2023,2023,7,27,18.3,15.1,21.8,1.6,0
28/07/2023,2023,7,28,20.1,17.4,23.3,0,0
29/07/2023,2023,7,29,20.3,17.8,23.2,0,0
30/07/2023,2023,7,30,19.7,16.7,22.4,2,0
31/07/2023,2023,7,31,19.3,16.1,21.5,0.5,0
08/01/2023,2023,8,1,21.1,18.6,23.9,2,0
08/02/2023,2023,8,2,20.2,18.2,23.8,1,0
08/03/2023,2023,8,3,20.1,18.9,22.5,0.5,0
08/04/2023,2023,8,4,19.6,17.7,21.7,9.9,0
08/05/2023,2023,8,5,18.8,16.9,23,26.9,0
08/06/2023,2023,8,6,18.3,16,19.4,7.9,0
08/07/2023,2023,8,7,18.7,16,22.8,8.9,0
08/08/2023,2023,8,8,18.9,16.8,22.2,2,0
08/09/2023,2023,8,9,19.4,16,22.9,0,0
08/10/2023,2023,8,10,19.9,17.4,23,0.5,0
08/11/2023,2023,8,11,19.8,15.7,23.6,0,0
08/12/2023,2023,8,12,20.2,18.4,22.8,5.1,0
13/08/2023,2023,8,13,20.4,19.2,23.6,6.1,0
14/08/2023,2023,8,14,19.8,18.7,21.2,0.5,0
15/08/2023,2023,8,15,20.4,17.5,23.5,2,0
16/08/2023,2023,8,16,20.5,17.9,24.5,0.5,0
17/08/2023,2023,8,17,21,17.4,26,0,0
18/08/2023,2023,8,18,20.2,16.5,25.2,0,0
19/08/2023,2023,8,19,20,15.7,24.8,1.7,0
20/08/2023,2023,8,20,19.5,16.1,24.3,0,0
21/08/2023,2023,8,21,19.9,14.6,25.2,1,0
22/08/2023,2023,8,22,19.8,17.1,23.3,0,0
23/08/2023,2023,8,23,20.2,18,22.3,15,0
24/08/2023,2023,8,24,19.6,16.1,22.5,1,0
25/08/2023,2023,8,25,20.3,17.9,23.7,0,0
26/08/2023,2023,8,26,20.3,17.6,23.7,2,0
27/08/2023,2023,8,27,20.5,17.7,23.4,0,0
28/08/2023,2023,8,28,20.6,17,24.2,3,0
29/08/2023,2023,8,29,20.8,18.2,24.6,0,0
30/08/2023,2023,8,30,18.7,15.7,20.5,0.5,0
31/08/2023,2023,8,31,19,16.6,22.6,7.1,0
09/01/2023,2023,9,1,19.8,14.9,23.6,0,0
09/02/2023,2023,9,2,19.8,17.7,23.2,3,0
09/03/2023,2023,9,3,20.3,17.9,23.9,5.1,0
09/04/2023,2023,9,4,18.7,17.5,22.5,7.9,0
09/05/2023,2023,9,5,19.9,17.4,23.5,6.1,0
09/06/2023,2023,9,6,20.3,16.3,24.5,0,0
09/07/2023,2023,9,7,20.6,17.7,25,0.3,0
09/08/2023,2023,9,8,20.4,15.8,24.5,0,0
09/09/2023,2023,9,9,20.7,17.6,24.6,0,0
09/10/2023,2023,9,10,21.2,18.6,24.9,0,0
09/11/2023,2023,9,11,20.3,18.3,23.8,1,0
09/12/2023,2023,9,12,20.3,17.7,22.7,1,0
13/09/2023,2023,9,13,21.1,18.5,24.5,4.1,0
14/09/2023,2023,9,14,20.3,17.7,24,0.3,0
15/09/2023,2023,9,15,19.5,15.3,23.6,0,0
16/09/2023,2023,9,16,20.7,18.2,23.8,0.5,0
17/09/2023,2023,9,17,20.1,18.2,23.3,6.1,0
18/09/2023,2023,9,18,21.1,18.6,24.2,3,0
19/09/2023,2023,9,19,20.5,17.2,24.3,0,0
20/09/2023,2023,9,20,21.5,19.4,24.5,0,0
21/09/2023,2023,9,21,21.7,20.1,25,0,0
22/09/2023,2023,9,22,21.3,17.6,24.8,0,0
23/09/2023,2023,9,23,20.1,15.9,24.4,0,0
24/09/2023,2023,9,24,19.7,17.1,22.5,4.1,0
25/09/2023,2023,9,25,19.4,16.9,23.1,2,0
26/09/2023,2023,9,26,20.2,15.3,23.7,1,0
27/09/2023,2023,9,27,20.8,18.5,24.1,0.3,0
28/09/2023,2023,9,28,20.3,18.6,23,1,0
29/09/2023,2023,9,29,21.2,18,24.3,7.9,0
30/09/2023,2023,9,30,21.1,18.8,24.3,0,0
10/01/2023,2023,10,1,21.6,16.9,25.2,1.1,0
10/02/2023,2023,10,2,21.9,18.8,26.2,0,0
10/03/2023,2023,10,3,22.1,17.1,27.2,0,0
10/04/2023,2023,10,4,20.4,19.4,22.1,0,0
10/05/2023,2023,10,5,19.7,17.2,24,0.2,0
10/06/2023,2023,10,6,19.9,17.2,23.6,0,0
10/07/2023,2023,10,7,20.7,18.2,24.9,0,0
10/08/2023,2023,10,8,20.8,17.3,24.7,0,0
10/09/2023,2023,10,9,21.4,18.5,26.5,0,0
10/10/2023,2023,10,10,21.3,17.7,26.3,0,0
10/11/2023,2023,10,11,20.3,15.8,26.7,0,0
10/12/2023,2023,10,12,21.5,17.9,26.5,0,0
13/10/2023,2023,10,13,21.1,18.1,24.2,0,0
14/10/2023,2023,10,14,20.5,17.3,23.4,0.5,0
15/10/2023,2023,10,15,20.7,17,25.5,0,0
16/10/2023,2023,10,16,22.2,17.4,26.8,0,0
17/10/2023,2023,10,17,23.1,18.7,28.5,0.4,0
18/10/2023,2023,10,18,22.3,19.9,27.3,0,0
19/10/2023,2023,10,19,22.8,20,25.7,8.9,0
20/10/2023,2023,10,20,23.2,19.9,26.9,0,0
21/10/2023,2023,10,21,22.9,18.2,27.4,0,0
22/10/2023,2023,10,22,22.6,19.4,26.7,0,0
23/10/2023,2023,10,23,23.2,19.5,27.1,3,0
24/10/2023,2023,10,24,23.6,19.9,27.5,0,0
25/10/2023,2023,10,25,23.4,20.5,27.8,0,0
26/10/2023,2023,10,26,23.7,20.3,27.2,0,0
27/10/2023,2023,10,27,22.1,19.4,25.8,0,0
28/10/2023,2023,10,28,21.4,19.2,26.5,21.1,0
29/10/2023,2023,10,29,23.1,19.5,26.3,43.9,0
30/10/2023,2023,10,30,23.6,19.9,27.2,0,0
31/10/2023,2023,10,31,23.9,20.8,28.3,0,0
11/01/2023,2023,11,1,23.4,20.2,27.2,0,0
11/02/2023,2023,11,2,24.1,20,27.3,3,0
11/03/2023,2023,11,3,23.4,20.3,27.3,0,0
11/04/2023,2023,11,4,22,19.3,25.8,12.7,0
11/05/2023,2023,11,5,21.9,19.9,25.9,0.5,0
11/06/2023,2023,11,6,21.2,19.1,23.5,2.9,0
11/07/2023,2023,11,7,22.3,19.7,25.6,11.9,0
11/08/2023,2023,11,8,21.9,19.7,26.5,5.1,0
11/09/2023,2023,11,9,23.5,19.5,27,77,0
11/10/2023,2023,11,10,22.6,20.8,26.7,0,0
11/11/2023,2023,11,11,22,20.3,24.4,12.9,0
11/12/2023,2023,11,12,23,20,27.2,3,0
13/11/2023,2023,11,13,21.9,16.8,26.9,0,0
14/11/2023,2023,11,14,22.9,20.5,26.2,0,0
15/11/2023,2023,11,15,21.8,20.9,24.1,6.1,0
16/11/2023,2023,11,16,22.2,20.5,25.5,0.8,0
17/11/2023,2023,11,17,23,19,27.8,7.1,0
18/11/2023,2023,11,18,23.2,18.9,27,0,0
19/11/2023,2023,11,19,23.1,18.7,27,0,0
20/11/2023,2023,11,20,24.4,21.2,27.9,4.1,0
21/11/2023,2023,11,21,24.6,21.7,27.6,0,0
22/11/2023,2023,11,22,23.9,21.9,28.1,0.5,0
23/11/2023,2023,11,23,22.4,20.2,26.5,3,0
24/11/2023,2023,11,24,22.6,20.3,25.4,4.1,0
25/11/2023,2023,11,25,21.9,18.9,25.7,2,0
26/11/2023,2023,11,26,21.9,18.7,25.1,0,0
27/11/2023,2023,11,27,23,18.5,27.7,0,0
28/11/2023,2023,11,28,21.8,18.9,27.5,8.2,0
29/11/2023,2023,11,29,23.5,19.9,26.5,6.6,0
30/11/2023,2023,11,30,24.3,20.3,28,0,0
12/01/2023,2023,12,1,23.9,19.4,27.3,0,0
12/02/2023,2023,12,2,22.6,20.2,24.8,6.1,0
12/03/2023,2023,12,3,23.4,21,25.6,35.1,0
12/04/2023,2023,12,4,23,19.8,25.4,5.1,0
12/05/2023,2023,12,5,23.7,20.2,26.9,0,0
12/06/2023,2023,12,6,24.4,21.4,27.3,0,0
12/07/2023,2023,12,7,24.6,21.9,28.8,0.3,0
12/08/2023,2023,12,8,24.7,22.4,28.2,0,0
12/09/2023,2023,12,9,24.1,21.7,27.8,1,0
12/10/2023,2023,12,10,23.5,21.9,25.9,62,0
12/11/2023,2023,12,11,23.8,21.4,27.8,29,0
12/12/2023,2023,12,12,23,19.4,26.6,0.3,0
13/12/2023,2023,12,13,24.8,21.6,29,0,0
14/12/2023,2023,12,14,25.4,22.3,28.7,0,0
15/12/2023,2023,12,15,25.4,22.5,28.7,0,0
16/12/2023,2023,12,16,24.4,20.6,28.2,2,0
17/12/2023,2023,12,17,23.4,20.2,26.8,4.2,0
18/12/2023,2023,12,18,25.4,22.8,28.6,0.3,0
19/12/2023,2023,12,19,23.1,21.2,26.9,5.1,0
20/12/2023,2023,12,20,25.5,20.7,29.5,29,0
21/12/2023,2023,12,21,25.1,21.4,28.4,0,0
22/12/2023,2023,12,22,26.3,23.4,29.8,7.1,0
23/12/2023,2023,12,23,24.7,21,29.6,0,0
24/12/2023,2023,12,24,24.4,21.9,26.9,1.3,0
25/12/2023,2023,12,25,25.6,21.1,27.6,10.9,0
26/12/2023,2023,12,26,24.8,20.6,29.7,3,0
27/12/2023,2023,12,27,24.2,18.9,29,0,0
28/12/2023,2023,12,28,23.8,18.5,27.9,0,0
29/12/2023,2023,12,29,24.6,21.4,28.8,0,0
30/12/2023,2023,12,30,24.2,21.7,28,1,0
31/12/2023,2023,12,31,23.6,21.3,26.3,6.1,0
01/01/2024,2024,1,1,24.2,22.2,27.5,17,0
01/02/2024,2024,1,2,23.9,22.1,28.3,17,0
01/03/2024,2024,1,3,26.3,21.9,29.5,32,0
01/04/2024,2024,1,4,26.6,23.9,29,24.9,0
01/05/2024,2024,1,5,25.4,23,27.6,3.9,0
01/06/2024,2024,1,6,26.4,24.3,29.7,2,0
01/07/2024,2024,1,7,25.5,22.2,28.6,10.9,0
01/08/2024,2024,1,8,25.3,22.3,28.4,0,0
01/09/2024,2024,1,9,25.2,22.1,30.2,0,0
01/10/2024,2024,1,10,24.4,22.3,27,3,0
01/11/2024,2024,1,11,25.3,21.7,28.4,0,0
01/12/2024,2024,1,12,25.5,22.1,28.7,5.6,0
13/01/2024,2024,1,13,25.1,23.9,27.7,10.9,0
14/01/2024,2024,1,14,25.3,23.6,27.8,39.9,0
15/01/2024,2024,1,15,24.3,23.2,25.1,42.9,0
16/01/2024,2024,1,16,23.9,22.8,26.7,179.1,0
17/01/2024,2024,1,17,24.6,22.1,28.7,2,0
18/01/2024,2024,1,18,23.7,21.2,27,1.8,0
19/01/2024,2024,1,19,25.4,21.7,29.8,0,0
20/01/2024,2024,1,20,24.8,20.8,29.1,0,0
21/01/2024,2024,1,21,24.8,20.4,29.4,7.1,0
22/01/2024,2024,1,22,26.1,22.9,29.2,6.1,0
23/01/2024,2024,1,23,26.1,24.4,28.4,18,0
24/01/2024,2024,1,24,25.2,24.1,26.9,10.9,0
25/01/2024,2024,1,25,24.6,23.3,25.7,0,0
26/01/2024,2024,1,26,25.9,23.3,29.9,7.1,0
27/01/2024,2024,1,27,24.9,22.5,27.6,2,0
28/01/2024,2024,1,28,26.3,23.4,29.7,4.1,0
29/01/2024,2024,1,29,25.8,23.4,28.8,3,0
30/01/2024,2024,1,30,25.3,21.9,28.9,2,0
31/01/2024,2024,1,31,25.2,22.3,28.3,2,0
02/01/2024,2024,2,1,24.8,22.5,27.8,4.1,0
02/02/2024,2024,2,2,23.8,21.7,26.4,6.1,0
02/03/2024,2024,2,3,23.8,20,26.9,0,0
02/04/2024,2024,2,4,23.4,19.6,26.6,0,0
02/05/2024,2024,2,5,22.5,17.5,26.4,0,0
02/06/2024,2024,2,6,23.2,19.9,26,0,0
02/07/2024,2024,2,7,25.4,21.6,29.3,0.8,0
02/08/2024,2024,2,8,24.8,23.1,27.5,3,0
02/09/2024,2024,2,9,24.7,22.4,28.3,0,0
02/10/2024,2024,2,10,24.5,22.3,27.6,0,0
02/11/2024,2024,2,11,23.8,21.4,27.4,13.2,0
02/12/2024,2024,2,12,25.6,22.9,28.4,6.1,0
13/02/2024,2024,2,13,26.1,23.6,30.3,1,0
14/02/2024,2024,2,14,25.7,23.7,29.3,0.5,0
15/02/2024,2024,2,15,24.9,23.1,27.2,4.9,0
16/02/2024,2024,2,16,25.8,23.6,29.5,0.5,0
17/02/2024,2024,2,17,23.8,22.4,27.4,0,0
18/02/2024,2024,2,18,23.2,20.4,27.4,3,0
19/02/2024,2024,2,19,24,21.1,27.6,0,0
20/02/2024,2024,2,20,23.1,21.2,26.4,14,0
21/02/2024,2024,2,21,23.5,21.2,26.7,2.8,0
22/02/2024,2024,2,22,23.9,21.9,25.5,39.1,0
23/02/2024,2024,2,23,24.8,23.1,27.4,4,0
24/02/2024,2024,2,24,24.3,22.8,26.9,1,0
25/02/2024,2024,2,25,24.8,23.3,28.5,3,0
26/02/2024,2024,2,26,24.1,22.1,27.4,3,0
27/02/2024,2024,2,27,24.2,21.1,27.6,0.8,0
28/02/2024,2024,2,28,23.7,17.9,28.2,0,0
29/02/2024,2024,2,29,24.2,21,28.4,0,0
03/01/2024,2024,3,1,23.1,19.5,26.6,0,0
03/02/2024,2024,3,2,23.6,20.4,27,0,0
03/03/2024,2024,3,3,24.9,20.4,28.4,7.1,0
03/04/2024,2024,3,4,25.4,23.6,29.3,0.5,0
03/05/2024,2024,3,5,24.5,22.5,28.1,72.9,0
03/06/2024,2024,3,6,24.1,22.1,27.3,0,0
03/07/2024,2024,3,7,23.4,20.5,27.6,0,0
03/08/2024,2024,3,8,24.1,21.3,26.8,1,0
03/09/2024,2024,3,9,23.6,20.3,27.8,52.1,0
03/10/2024,2024,3,10,24.8,22.6,27.9,10.9,0
03/11/2024,2024,3,11,24.2,21.9,27.9,0,0
03/12/2024,2024,3,12,24.1,21.6,27.7,1,0
13/03/2024,2024,3,13,23.8,21.9,26.4,5.1,0
14/03/2024,2024,3,14,23.9,22.1,27.1,13,0
15/03/2024,2024,3,15,24.6,22,28,1,0
16/03/2024,2024,3,16,23.4,20.8,26.9,13,0
17/03/2024,2024,3,17,23.6,21.5,27,0.5,0
18/03/2024,2024,3,18,24.6,21.2,28.6,0,0
19/03/2024,2024,3,19,24.4,22.2,27.4,0,0
20/03/2024,2024,3,20,23.9,21.9,27.1,0.3,0
21/03/2024,2024,3,21,24.9,21.8,29.1,3,0
22/03/2024,2024,3,22,24.8,22.1,29,0,0
23/03/2024,2024,3,23,24.1,21.7,27.2,3,0
24/03/2024,2024,3,24,23.3,21.7,25.7,2.3,0
25/03/2024,2024,3,25,21.7,20.9,23.7,4.8,0
26/03/2024,2024,3,26,21.7,19.8,25,0.3,0
27/03/2024,2024,3,27,22,20.2,25.1,0.2,0
28/03/2024,2024,3,28,22.1,19.8,24.6,0.1,0
29/03/2024,2024,3,29,23.2,20.5,26.6,1.2,0
30/03/2024,2024,3,30,23.3,21.7,27.2,12.1,0
31/03/2024,2024,3,31,22.9,21.6,24.6,24.9,0
04/01/2024,2024,4,1,23.3,21.7,26,10.8,0
04/02/2024,2024,4,2,22.4,21.3,24.5,6.5,0
04/03/2024,2024,4,3,23.3,20.8,24.8,1,0
04/04/2024,2024,4,4,23.7,21,27.8,5.1,0
04/05/2024,2024,4,5,24.3,21.2,28.6,0,0
04/06/2024,2024,4,6,24.3,19.6,28.7,0,0
04/07/2024,2024,4,7,24.9,22.2,29.4,1,0
04/08/2024,2024,4,8,23.7,21.1,27.9,0.3,0
04/09/2024,2024,4,9,24.6,20.8,29.2,34,0
04/10/2024,2024,4,10,24.2,21.4,28.1,0,0
04/11/2024,2024,4,11,25.2,22.3,29.6,0,0
04/12/2024,2024,4,12,25.4,22.4,29.6,0,0
13/04/2024,2024,4,13,25.2,22.7,29,2,0
14/04/2024,2024,4,14,24.5,21.1,29.1,0,0
15/04/2024,2024,4,15,24,20.9,28,0,0
16/04/2024,2024,4,16,22.6,21.1,24,5.1,0
17/04/2024,2024,4,17,21.8,19.9,24.2,4.1,0
18/04/2024,2024,4,18,22.1,17.3,25.2,0.3,0
19/04/2024,2024,4,19,21.3,19.4,24.6,3,0
20/04/2024,2024,4,20,23.3,20.4,26.2,2,0
21/04/2024,2024,4,21,23.1,21.1,25.8,29,0
22/04/2024,2024,4,22,24.4,20.9,28.9,46,0
23/04/2024,2024,4,23,24.2,21.4,28.7,5.1,0
24/04/2024,2024,4,24,24,22.5,28.7,4.1,0
25/04/2024,2024,4,25,24.1,22.3,28.1,0,0
26/04/2024,2024,4,26,24.3,21.1,28.1,0.5,0
27/04/2024,2024,4,27,24.3,22,27.7,0,0
28/04/2024,2024,4,28,23.7,21.6,27.7,0,0
29/04/2024,2024,4,29,23.4,21.6,27.3,0,0
30/04/2024,2024,4,30,23.1,20.4,27.3,1,0
05/01/2024,2024,5,1,21.8,19.5,24.5,0,0
05/02/2024,2024,5,2,23.3,20.7,27.3,0,0
05/03/2024,2024,5,3,23.8,20.8,27.7,1,0
05/04/2024,2024,5,4,22.8,20.5,28.3,0,0
05/05/2024,2024,5,5,21.1,19.6,25.3,21.1,0
05/06/2024,2024,5,6,20.9,19,23.3,7.9,0
05/07/2024,2024,5,7,21.5,19.7,23.9,0.4,0
05/08/2024,2024,5,8,21.3,19.8,23.3,1,0
05/09/2024,2024,5,9,21.4,19.3,23.7,5.1,0
05/10/2024,2024,5,10,21.8,19.4,24.7,0.3,0
05/11/2024,2024,5,11,21.3,19.2,23.9,0,0
05/12/2024,2024,5,12,21.8,20.1,24.9,1.1,0
13/05/2024,2024,5,13,22.4,17.1,25.5,0,0
14/05/2024,2024,5,14,21.2,18.7,25,0,0
15/05/2024,2024,5,15,20.9,18.4,22.7,0,0
16/05/2024,2024,5,16,20.3,18.8,22.4,3,0
17/05/2024,2024,5,17,20.4,18.2,22.9,1,0
18/05/2024,2024,5,18,21.3,17.9,24.8,0,0
19/05/2024,2024,5,19,21.5,19.4,25.8,0,0
20/05/2024,2024,5,20,21.4,19.6,24.6,0,0
21/05/2024,2024,5,21,19.6,18.3,21.6,5.8,0
22/05/2024,2024,5,22,19.3,18.1,21.2,0.6,0
23/05/2024,2024,5,23,19.2,16.8,21.9,5.1,0
24/05/2024,2024,5,24,19.6,17.9,21.9,4.1,0
25/05/2024,2024,5,25,20.5,18.9,22.3,2,0
26/05/2024,2024,5,26,22.3,20.1,24.6,0.5,0
27/05/2024,2024,5,27,22.4,20.4,26.2,1,0
28/05/2024,2024,5,28,22.1,20.4,25,5.1,0
29/05/2024,2024,5,29,21.9,20.7,23.8,5.1,0
30/05/2024,2024,5,30,21.2,19.8,22.1,19.1,0
31/05/2024,2024,5,31,20.6,19.5,22.8,8.9,0
06/01/2024,2024,6,1,20.6,18.6,23,2,0
06/02/2024,2024,6,2,20.7,18.3,22.8,3,0
06/03/2024,2024,6,3,19.5,15,23.3,0,0
06/04/2024,2024,6,4,19.2,17.1,22.9,0,0
06/05/2024,2024,6,5,19.6,17.4,23.2,8.9,0
06/06/2024,2024,6,6,19.8,17.6,23,8.9,0
06/07/2024,2024,6,7,20.3,17,23.2,0,0
06/08/2024,2024,6,8,20.3,17,23.4,1,0
06/09/2024,2024,6,9,20.1,17.5,22.3,4.1,0
06/10/2024,2024,6,10,20.4,18.9,22.5,7.9,0
06/11/2024,2024,6,11,21,19.6,22.9,1,0
06/12/2024,2024,6,12,21.1,19.5,23.5,1,0
13/06/2024,2024,6,13,20.7,19.9,22,1,0
14/06/2024,2024,6,14,20.9,19.9,22.6,3,0
15/06/2024,2024,6,15,21.8,20.4,24,0.5,0
16/06/2024,2024,6,16,21.6,20.5,24.3,11.2,0
17/06/2024,2024,6,17,21.2,17.7,24.2,14,0
18/06/2024,2024,6,18,20.2,17.1,23.2,0,0
19/06/2024,2024,6,19,19.1,15.6,21.6,0,0
20/06/2024,2024,6,20,19.4,17.3,23.9,3,0
21/06/2024,2024,6,21,18.9,16.8,21.7,0.8,0
22/06/2024,2024,6,22,18.5,16.7,20.4,2,0
23/06/2024,2024,6,23,19.1,15.9,20.5,23.9,0
24/06/2024,2024,6,24,18.5,17.4,23,0,0
25/06/2024,2024,6,25,19.8,18.3,22.9,16,0
26/06/2024,2024,6,26,19.8,17.2,22.5,1,0
27/06/2024,2024,6,27,17.9,15.7,20.7,0,0
28/06/2024,2024,6,28,17.5,16.1,19.9,0.5,0
29/06/2024,2024,6,29,18.2,15.9,21.5,6.1,0
30/06/2024,2024,6,30,17.7,16.6,22.5,0,0
07/01/2024,2024,7,1,19.3,17.2,21.6,2,0
07/02/2024,2024,7,2,19.1,17.1,22.5,5.1,0
07/03/2024,2024,7,3,18.6,17,22,0,0
07/04/2024,2024,7,4,18.1,16.7,22,10.9,0
07/05/2024,2024,7,5,18.8,15.4,22.1,0.8,0
07/06/2024,2024,7,6,19.4,16.2,23.3,0,0
07/07/2024,2024,7,7,19.5,15.2,34,0,0
07/08/2024,2024,7,8,19.9,15.9,24,0,0
07/09/2024,2024,7,9,19.1,14.5,22.6,0,0
07/10/2024,2024,7,10,17.6,12.8,22.4,0,0
07/11/2024,2024,7,11,19.7,16.5,22.9,2,0
07/12/2024,2024,7,12,20,18.3,23.1,8.9,0
13/07/2024,2024,7,13,18.6,17.1,21.6,0.7,0
14/07/2024,2024,7,14,19.2,16.6,21.5,0.5,0
15/07/2024,2024,7,15,19.1,16.5,21.4,1,0
16/07/2024,2024,7,16,18.5,16.9,20.8,1,0
17/07/2024,2024,7,17,19.2,16.9,22.1,5.1,0
18/07/2024,2024,7,18,19.8,15.3,23.3,0,0
19/07/2024,2024,7,19,18.3,15.4,20.7,0.5,0
20/07/2024,2024,7,20,20.5,15.6,24,0,0
21/07/2024,2024,7,21,18.2,15.2,22.3,0,0
22/07/2024,2024,7,22,19.8,16.1,24,0,0
23/07/2024,2024,7,23,19.7,16.4,24,0,0
24/07/2024,2024,7,24,19.7,17.3,23,1,0
25/07/2024,2024,7,25,18.8,14.8,23.6,2,0
26/07/2024,2024,7,26,19.6,17,24,0,0
27/07/2024,2024,7,27,19.5,14.7,23.8,0.8,0
28/07/2024,2024,7,28,20.1,14.7,23.5,0,0
29/07/2024,2024,7,29,18.3,14.6,23.5,0,0
30/07/2024,2024,7,30,19.3,13.5,22.4,0,0
31/07/2024,2024,7,31,18.3,14.1,23.2,0,0
08/01/2024,2024,8,1,19.8,13.5,25,0,0
08/02/2024,2024,8,2,18.6,12.8,23.5,0,0
08/03/2024,2024,8,3,18,14.5,22,0,0
08/04/2024,2024,8,4,19.2,15.6,23.2,0.5,0
08/05/2024,2024,8,5,18.4,15.2,23,0,0
08/06/2024,2024,8,6,19.6,14.7,24,0,0
08/07/2024,2024,8,7,18.7,13.1,23.5,0,0
08/08/2024,2024,8,8,19.7,16,24.1,0,0
08/09/2024,2024,8,9,19.3,16.7,23.2,0,0
08/10/2024,2024,8,10,19.8,17.2,23.3,0.3,0
08/11/2024,2024,8,11,19.2,17.1,23.2,3,0
08/12/2024,2024,8,12,19.2,16.7,22.6,0.3,0
13/08/2024,2024,8,13,19.1,15.1,24.4,0.5,0
14/08/2024,2024,8,14,19,17.1,23.4,3,0
15/08/2024,2024,8,15,19.8,17.5,23.1,0,0
16/08/2024,2024,8,16,20.5,18.2,25,0.8,0
17/08/2024,2024,8,17,19.6,17.5,23.2,2,0
18/08/2024,2024,8,18,18.6,16.7,20.7,10.9,0
19/08/2024,2024,8,19,17.3,15.9,18.6,0,0
20/08/2024,2024,8,20,17.8,15,21,5.1,0
21/08/2024,2024,8,21,17.5,15.6,20.2,5.1,0
22/08/2024,2024,8,22,18.3,15.5,22.5,1,0
23/08/2024,2024,8,23,19.3,16.1,23.9,0.8,0
24/08/2024,2024,8,24,18.6,15.4,23.9,0,0
25/08/2024,2024,8,25,18.2,15.9,21.9,0,0
26/08/2024,2024,8,26,17.5,15.3,21.3,0.3,0
27/08/2024,2024,8,27,17.3,14.6,21,2,0
28/08/2024,2024,8,28,17.9,15.5,20.5,8.9,0
29/08/2024,2024,8,29,18.2,15.9,22.2,7.9,0
30/08/2024,2024,8,30,19.1,16.9,22.8,1,0
31/08/2024,2024,8,31,18.2,17,20.8,2,0
09/01/2024,2024,9,1,19.4,16.2,23.5,6.1,0
09/02/2024,2024,9,2,19.3,17.1,23,1,0
09/03/2024,2024,9,3,19.7,17.1,23.8,0,0
09/04/2024,2024,9,4,20.1,18,23.6,0.5,0
09/05/2024,2024,9,5,19.9,18.5,23.3,0.8,0
09/06/2024,2024,9,6,19.9,18.2,23.4,3,0
09/07/2024,2024,9,7,20.1,17.4,24.1,0,0
09/08/2024,2024,9,8,19.5,17.4,22.9,1,0
09/09/2024,2024,9,9,19.4,17.2,22.6,1,0
09/10/2024,2024,9,10,20.4,17.8,24.7,1,0
09/11/2024,2024,9,11,20.6,17.4,25.3,0,0
09/12/2024,2024,9,12,20.2,16.3,25.2,0,0
13/09/2024,2024,9,13,19.3,15.4,24.7,1.4,0
14/09/2024,2024,9,14,18.3,16.7,21.2,0,0
15/09/2024,2024,9,15,17.9,14.8,21.8,0,0
16/09/2024,2024,9,16,18.4,15.7,22.3,0.5,0
17/09/2024,2024,9,17,19.2,14.9,24.2,1,0
18/09/2024,2024,9,18,20.1,17.2,24.4,1,0
19/09/2024,2024,9,19,19.7,17.1,22.6,0,0
20/09/2024,2024,9,20,20.6,17.6,25,2,0
21/09/2024,2024,9,21,20.7,17.7,24.3,0.5,0
22/09/2024,2024,9,22,20.8,18.2,24.5,0.8,0
23/09/2024,2024,9,23,21.1,17,26.1,0,0
24/09/2024,2024,9,24,20.2,16.9,24.6,0,0
25/09/2024,2024,9,25,20.6,17.7,24.5,0.3,0
26/09/2024,2024,9,26,19.9,17.6,24.1,1,0
27/09/2024,2024,9,27,20.3,17.9,24,5.1,0
28/09/2024,2024,9,28,21.6,17.8,26.1,0.8,0
29/09/2024,2024,9,29,20.7,16.2,24.5,0,0
30/09/2024,2024,9,30,20.3,17.2,24.1,0,0
10/01/2024,2024,10,1,20.2,18.6,24.4,1,0
10/02/2024,2024,10,2,20.6,17.6,25.7,2,0
10/03/2024,2024,10,3,19.4,16.9,22.3,0,0
10/04/2024,2024,10,4,19.8,18,22.8,5.9,0
10/05/2024,2024,10,5,18.9,16,22.8,9.9,0
10/06/2024,2024,10,6,18.9,14.4,23.2,0,0
10/07/2024,2024,10,7,19.6,15,25.1,0,0
10/08/2024,2024,10,8,21.9,18.4,26,0.3,0
10/09/2024,2024,10,9,20.1,18.2,23.8,0,0
10/10/2024,2024,10,10,20.8,17.7,24.1,0,0
10/11/2024,2024,10,11,20.8,17.9,23.7,0,0
10/12/2024,2024,10,12,20.6,17.3,24,0,0
13/10/2024,2024,10,13,18.7,16.6,22.9,1,0
14/10/2024,2024,10,14,19.4,16.7,23.3,0.2,0
15/10/2024,2024,10,15,19.6,18,22.4,2,0
16/10/2024,2024,10,16,20.7,17.9,25,5.1,0
17/10/2024,2024,10,17,21.3,18.1,25.9,0,0
18/10/2024,2024,10,18,21.1,18.2,25.3,0,0
19/10/2024,2024,10,19,21.5,18.4,25.6,6.1,0
20/10/2024,2024,10,20,22.2,18.6,26.1,0,0
21/10/2024,2024,10,21,21.4,18.4,25.2,0,0
22/10/2024,2024,10,22,21,19.1,24.1,0.5,0
23/10/2024,2024,10,23,20.8,18.6,24.5,4.1,0
24/10/2024,2024,10,24,19.4,18.4,24.1,1,0
25/10/2024,2024,10,25,21.3,19.5,24.7,8.9,0
26/10/2024,2024,10,26,22.3,20.3,25.4,3,0
27/10/2024,2024,10,27,23.5,20.4,27.5,2,0
28/10/2024,2024,10,28,23.3,20.1,28.2,0.8,0
29/10/2024,2024,10,29,22.9,19.9,26.9,0,0
30/10/2024,2024,10,30,21.2,18.8,25.7,0.3,0
31/10/2024,2024,10,31,21.4,17.4,25.7,0,0
11/01/2024,2024,11,1,21.3,18.7,25.2,0,0
11/02/2024,2024,11,2,22.9,19.1,26.9,0,0
11/03/2024,2024,11,3,22.2,19.9,26.5,0,0
11/04/2024,2024,11,4,20.8,17.7,24.2,6.9,0
11/05/2024,2024,11,5,21.9,17.7,26.9,0,0
11/06/2024,2024,11,6,23.1,18.3,27.2,0,0
11/07/2024,2024,11,7,22.3,20,26,1,0
11/08/2024,2024,11,8,22.3,19.4,26.1,0.8,0
11/09/2024,2024,11,9,23.6,20.1,28.3,0,0
11/10/2024,2024,11,10,24.2,20.9,28.7,0,0
11/11/2024,2024,11,11,23.8,20.6,27.6,0,0
11/12/2024,2024,11,12,23,19.7,26.7,0,0
13/11/2024,2024,11,13,23,19.7,27.8,0.3,0
14/11/2024,2024,11,14,22.9,19.7,27.6,0,0
15/11/2024,2024,11,15,23.4,20.4,27.6,18,0
16/11/2024,2024,11,16,22.3,18.4,26.3,0.8,0
17/11/2024,2024,11,17,22.8,20.5,26.4,2,0
18/11/2024,2024,11,18,21.8,18.9,25.1,0,0
19/11/2024,2024,11,19,22.1,19.2,25.5,3.5,0
20/11/2024,2024,11,20,22.2,20.4,24.7,11,0
21/11/2024,2024,11,21,22.6,20.6,24.6,18.5,0
22/11/2024,2024,11,22,23.2,21.7,26.6,30,0
23/11/2024,2024,11,23,23.4,20.4,26.5,7.1,0
24/11/2024,2024,11,24,23.1,21,26.9,0,0
25/11/2024,2024,11,25,23.7,19.2,28.6,0,0
26/11/2024,2024,11,26,23.5,19,27.2,0,0
27/11/2024,2024,11,27,22.6,19.8,26.3,1,0
28/11/2024,2024,11,28,22.8,20,26.8,0.3,0
29/11/2024,2024,11,29,22.8,19.5,26.1,1,0
30/11/2024,2024,11,30,23.1,19.6,27.7,4.1,0
12/01/2024,2024,12,1,21.7,18.4,25.1,4.7,0
12/02/2024,2024,12,2,24.1,20.4,27.4,0,0
12/03/2024,2024,12,3,21.7,18.5,25.6,2.1,0
12/04/2024,2024,12,4,22.7,20.1,27.5,0.3,0
12/05/2024,2024,12,5,23.6,19.8,28.1,0.5,0
12/06/2024,2024,12,6,23.6,19.6,27.4,0,0
12/07/2024,2024,12,7,23.1,20.1,26.8,2,0
12/08/2024,2024,12,8,23.8,20.1,28.4,3,0
12/09/2024,2024,12,9,24.5,20.5,29.5,0,0
12/10/2024,2024,12,10,24.2,21.9,27.4,0,0
12/11/2024,2024,12,11,22.3,21.5,24.3,3,0
12/12/2024,2024,12,12,22.9,21.3,27.1,10.9,0
13/12/2024,2024,12,13,23.5,20.4,27.3,2,0
14/12/2024,2024,12,14,23.7,19.6,28,0,0
15/12/2024,2024,12,15,24.1,20,28,0,0
16/12/2024,2024,12,16,23.2,20.9,27.4,7.9,0
17/12/2024,2024,12,17,22.5,19.8,26,1.9,0
18/12/2024,2024,12,18,22.9,19.7,26.7,0.3,0
19/12/2024,2024,12,19,23.3,20.2,27.2,0.2,0
20/12/2024,2024,12,20,23.1,19.6,28.6,3.4,0
21/12/2024,2024,12,21,22.7,18.7,27.1,0,0
22/12/2024,2024,12,22,23.1,19.8,26.9,1.4,0
23/12/2024,2024,12,23,23.3,20.6,27.1,0,0
24/12/2024,2024,12,24,23.2,19.2,27.3,0.8,0
25/12/2024,2024,12,25,23.4,19.6,28.7,1.9,0
26/12/2024,2024,12,26,23.3,19,28.4,0,0
27/12/2024,2024,12,27,22.8,18.9,26,4,0
28/12/2024,2024,12,28,25.3,21.5,29.9,0.3,0
29/12/2024,2024,12,29,23.3,20.7,28,8.1,0
30/12/2024,2024,12,30,22.9,20.4,27.1,7.2,0
31/12/2024,2024,12,31,22.5,19.9,25.5,3.9,0
